Local Body Code,Local Body Name,Local Body Type,"District Level
Parent Name
","Intermediate Level
Parent Name",Ward Code,"Ward
Number","Ward Name
(In English)
","Ward Name
(In Local)
"
104195,Bijoynagar,Village Panchayat,South Tripura,Satchand,117755,1,Bijoynagar I East Part of Barkhola Para,???????  I ??????? ??? ?? ????? ???
104195,Bijoynagar,Village Panchayat,South Tripura,Satchand,756910,2,Bijoynagar II South East Part of North Kalyanpur Para and South East Part of Barkhola Para,???????  II  ????? ????????? ???? ?? ?????? ????? ???  ??? ??????? ??? ?? ?????? ????? ???
104195,Bijoynagar,Village Panchayat,South Tripura,Satchand,756911,3,Bijoynagar III West Part of Kalyannagar Madhya Para and East Part of North Kalyannagar Para,???????  III ?????????  ???? ????  ?? ?????? ??? ??? ????? ????????? ?? ????? ???
104195,Bijoynagar,Village Panchayat,South Tripura,Satchand,756912,4,Bijoynagar IV Kalyannagar East Para and East Part of Kalyannagar Madhya Para,???????  IV ????????? ????? ???? ??? ????????? ???? ???? ??  ????? ???
104195,Bijoynagar,Village Panchayat,South Tripura,Satchand,756913,5,Bijoynagar V South Kalyan south kalyannagar and South Part of Kalyannagar Madhya Para,???????  V ?????? ????????? ??? ????????? ???? ???? ?? ?????? ???
104196,Brajendranagar,Village Panchayat,South Tripura,Satchand,107510,1,Brajendranagar I Chabagan Para of East Side of Singbil Pathar,????????????? I ??????? ???? ?? ????? ??? ?? ?????? ?????
104196,Brajendranagar,Village Panchayat,South Tripura,Satchand,756965,2,Brajendranagar II Nripendra Para of Addadar Tilla,????????????? II ??????????? ???? ?? ?????? ????
104196,Brajendranagar,Village Panchayat,South Tripura,Satchand,756967,3,Brajendranagar III Baganbari Para of Baganbari,????????????? III ????????? ???? ?? ?????????
104196,Brajendranagar,Village Panchayat,South Tripura,Satchand,756969,4,Brajendranagar IV No. 8 Tilla South Para,????????????? IV ? ?? ???? ?????? ????
104196,Brajendranagar,Village Panchayat,South Tripura,Satchand,756971,5,Brajendranagar V No. 8 Tilla North Para,????????????? V ? ?? ???? ?????  ????
104199,Damdama,Village Panchayat,South Tripura,Satchand,105794,1,Damdama I Banik Para and Singh Tilla of Damdama,???? I ???? ???? ??? ??? ???? ?? ????
104199,Damdama,Village Panchayat,South Tripura,Satchand,757006,2,Damdama II Das Para of Das Tilla and Madhya Basak Para,???? II ??? ???? ?? ??? ????  ??? ???? ???? ????
104199,Damdama,Village Panchayat,South Tripura,Satchand,757007,3,Damdama III Bhumihin Tilla of Damadama No. 2 and Barun Chowdhury Para,???? III ???? ? ?? ?? ??????? ???? ??? ???? ?????? ????
104199,Damdama,Village Panchayat,South Tripura,Satchand,757008,4,Damdama IV West Basak Para West Part of Bhumuhin Tilla of Damdama No. 2 and East Part of North Nama Para,???? IV ???? ?? ? ?? ??????? ???? ?? ?????? ???? ????? ?????? ??? ??? ????? ?? ????? ????? ???
104199,Damdama,Village Panchayat,South Tripura,Satchand,757009,5,Damdama V Kaiadori Para of North Kaiadori and West Part of North Nama Para,???? V ????? ??????? ?? ??????? ???? ??? ????? ?? ???? ?? ?????? ???
104200,Doulbari,Village Panchayat,South Tripura,Satchand,116003,1,Doulbari I South side of Lal Tilla and Gangfira Part,???????? I  ??? ???? ?? ?????? ??? ??? ??????? ???
104200,Doulbari,Village Panchayat,South Tripura,Satchand,757023,2,Doulbari II Gangfira Part and School Para Ramesh Para of Madhya Doulbari,???????? II ??????? ??? ??? ???? ???????? ?? ???? ???? ?? ????? ????
104200,Doulbari,Village Panchayat,South Tripura,Satchand,757024,3,Doulbari III West side of Harina Tilla Part,???????? III ????? ???? ????? ?????? ???
104200,Doulbari,Village Panchayat,South Tripura,Satchand,757025,4,Doulbari IV Madhya Doulbari and East Side of Harina Tilla,???????? IV ???? ???????? ??? ????? ????? ????? ???
104200,Doulbari,Village Panchayat,South Tripura,Satchand,757026,5,Doulbari V Part of Madhya Doulbari,???????? V ???? ???????? ???
104200,Doulbari,Village Panchayat,South Tripura,Satchand,757027,6,Doulbari VI South Nama Para and Madhya Doulbari Part,???????? VI ?????? ?? ???? ??? ???? ???????? ???
104213,East Harina,Village Panchayat,South Tripura,Satchand,96364,1,East Harina I Bijoy Shil Para East Part of Kathalchari Para and North Part of Harina Colony Para,????? ????? I ????????? ????? ????? ????? ???? ??? ????
104213,East Harina,Village Panchayat,South Tripura,Satchand,757055,2,East Harina II South East Side of South Para of Harina Colony Para,????? ????? II  ????? ????? ???? ?? ?????? ???? ?? ?????? ????? ???
104213,East Harina,Village Panchayat,South Tripura,Satchand,757056,3,East Harina III North Para and South Part of Kathalchari Para,????? ????? III ????? ???? ??? ????????? ????? ?????? ???
104213,East Harina,Village Panchayat,South Tripura,Satchand,757057,4,East Harina IV Kathalchari Para,????? ????? IV  ????????? ????
104213,East Harina,Village Panchayat,South Tripura,Satchand,757058,5,East Harina V South Para,????? ????? V ?????? ????
104214,East Jalefa,Village Panchayat,South Tripura,Satchand,757123,1,East Jalefa I Lal Chand Para,????? ??????  I ??? ????? ????
104214,East Jalefa,Village Panchayat,South Tripura,Satchand,757124,2,East Jalefa II Shib Palli,????? ??????  II ??? ?????
104214,East Jalefa,Village Panchayat,South Tripura,Satchand,757125,3,East Jalefa III Chatteswari Palli and Durganagar,????? ??????  III ?????????? ????? ??? ?????????
104214,East Jalefa,Village Panchayat,South Tripura,Satchand,757126,4,East Jalefa IV Paul Palli,????? ??????  IV ??? ?????
104214,East Jalefa,Village Panchayat,South Tripura,Satchand,757127,5,East Jalefa V Rajnagar,????? ??????  V ??????
104201,Goachand Nandigram,Village Panchayat,South Tripura,Satchand,88068,1,Goachand Nandigram I Mog Para,???????? ?????????? I
104201,Goachand Nandigram,Village Panchayat,South Tripura,Satchand,757179,2,Goachand Nandigram II Master Para,???????? ?????????? II
104201,Goachand Nandigram,Village Panchayat,South Tripura,Satchand,757180,3,Goachand Nandigram III South Para of South Goachand Para,???????? ?????????? III
104201,Goachand Nandigram,Village Panchayat,South Tripura,Satchand,757181,4,Goachand Nandigram IV Nath Para,???????? ?????????? IV
104201,Goachand Nandigram,Village Panchayat,South Tripura,Satchand,757182,5,Goachand Nandigram V West Para,???????? ?????????? V
104202,Indiranagar,Village Panchayat,South Tripura,Satchand,93186,1,Indiranagar I East Ramendra Nagar,
104202,Indiranagar,Village Panchayat,South Tripura,Satchand,757209,2,Indiranagar II Madhya Para Part of North Ramendra Nagar,
104202,Indiranagar,Village Panchayat,South Tripura,Satchand,757210,3,Indiranagar III East Manu Tilla of East Manu Ghat,
104202,Indiranagar,Village Panchayat,South Tripura,Satchand,757211,4,Indiranagar IV Office Tilla of West Ramendra Nagar,
104202,Indiranagar,Village Panchayat,South Tripura,Satchand,757212,5,Indiranagar V Madhya Para Part of North Ramendra Nagar,
104202,Indiranagar,Village Panchayat,South Tripura,Satchand,757213,6,Indiranagar VI South Para of West Ramendra Nagar,
104203,Kalachara,Village Panchayat,South Tripura,Satchand,757279,1,Kalachara I Nandalal Para of Kalachara and Chowkidar Para of Madhya Para,??????? I
104203,Kalachara,Village Panchayat,South Tripura,Satchand,757280,2,Kalachara II Ramkrishna Para Part and Paresh Raj Para Part,??????? II
104203,Kalachara,Village Panchayat,South Tripura,Satchand,757281,3,Kalachara III Narayan Das Para of Das Para and Ramkrishna Para of Gobinda Para,??????? III
104203,Kalachara,Village Panchayat,South Tripura,Satchand,757282,4,Kalachara IV Ram Goa Colony US road and ONGC road Southern side of Ashim Das Para Gopinath Para and West Part of Paresh Raj Para,??????? IV
104203,Kalachara,Village Panchayat,South Tripura,Satchand,757283,5,Kalachara V East Part of Paresh Raj Para,??????? V
104204,Kalapania,Village Panchayat,South Tripura,Satchand,116459,1,Kalapania I Nabin Datta Para of Prabin Para and East Part of Natun Palli,?????????? I
104204,Kalapania,Village Panchayat,South Tripura,Satchand,757320,2,Kalapania II Madhya Part of Kalapania School Tilla and Paul Para,?????????? II
104204,Kalapania,Village Panchayat,South Tripura,Satchand,757321,3,Kalapania III West Part of Natun Palli and West Part of Kalapania School Tilla,?????????? III
104204,Kalapania,Village Panchayat,South Tripura,Satchand,757322,4,Kalapania IV Kangchai Mog Para Part and Batta Tilla of Kangchai Mog Para,?????????? IV
104204,Kalapania,Village Panchayat,South Tripura,Satchand,757323,5,Kalapania V Das Para of Block Tilla and Angiya Mog Para,?????????? V
104207,Magurcherra,Village Panchayat,South Tripura,Satchand,102456,1,Magurcherra I Bhowmik Para,????????? I
104207,Magurcherra,Village Panchayat,South Tripura,Satchand,757370,2,Magurcherra II Saha Para,????????? II
104207,Magurcherra,Village Panchayat,South Tripura,Satchand,757371,3,Magurcherra III Biswas Para and East Part of Durgabari Para,????????? III
104207,Magurcherra,Village Panchayat,South Tripura,Satchand,757372,4,Magurcherra IV Durgabari Para,????????? IV
104207,Magurcherra,Village Panchayat,South Tripura,Satchand,757373,5,Magurcherra V Nath Para,????????? V
104208,Manu Bazar,Village Panchayat,South Tripura,Satchand,110510,1,Manu Bazar I Karmakar Para Sitla Bari South Side to Gaocharan Bhumi to Kali Mandir to Chaudda Debata Bari and Part of Sanjoy Palli of Left Side of Road Podder Para,??? ????? I
104208,Manu Bazar,Village Panchayat,South Tripura,Satchand,757459,2,Manu Bazar II Laskar Para Part of Banik Para,??? ????? II
104208,Manu Bazar,Village Panchayat,South Tripura,Satchand,757460,3,Manu Bazar III Laskar Para Part of Puran Bazar and Das Para,??? ????? III
104208,Manu Bazar,Village Panchayat,South Tripura,Satchand,757461,4,Manu Bazar IV Menaka Pur Shib Mandir to Manu Tehsil Office and Sanjoy Palli Part of East Shanti Para,??? ????? IV
104208,Manu Bazar,Village Panchayat,South Tripura,Satchand,757462,5,Manu Bazar V West Part of Shanti Para and Sanjoy Palli Part of Podder Para,??? ????? V
104209,Nabagram,Village Panchayat,South Tripura,Satchand,87998,1,Nabagram II Nim Chand Sarkar Para,??????? I
104209,Nabagram,Village Panchayat,South Tripura,Satchand,757527,2,Nabagram II Pichan Das Para and West Part of ONGC Para,??????? II
104209,Nabagram,Village Panchayat,South Tripura,Satchand,757528,3,Nabagram III East Part of ONGC Para of New Manu Colony,??????? III
104209,Nabagram,Village Panchayat,South Tripura,Satchand,757529,4,Nabagram IV 39 Card Para,??????? IV
104209,Nabagram,Village Panchayat,South Tripura,Satchand,757530,5,Nabagram V Ghosh Tilla and Ghosh Para of North Manu Part,??????? V
104222,North Bhuratali,Village Panchayat,South Tripura,Satchand,117327,1,North Bhuratali I Krishna Chowdhury Para of Phani Deb Amin Para and Part of Bhanu Debnath Para of Nath Para,????? ??????? I
104222,North Bhuratali,Village Panchayat,South Tripura,Satchand,757582,2,North Bhuratali II Shil Para 11 Card Raj Mohan Para and Part of Nath Para,????? ??????? II
104222,North Bhuratali,Village Panchayat,South Tripura,Satchand,757583,3,North Bhuratali III Sudhir Das Para of Chaiddya Debata Bari and Dhirendra Nath Para,????? ??????? III
104222,North Bhuratali,Village Panchayat,South Tripura,Satchand,757584,4,North Bhuratali IV Hospital Tilla Sudhir Das Para of Chaiddya Debata Bari and Acharjee Para,????? ??????? IV
104222,North Bhuratali,Village Panchayat,South Tripura,Satchand,757585,5,North Bhuratali V Das Para,????? ??????? V
104215,Rajibnagar,Village Panchayat,South Tripura,Satchand,93962,1,Rajibnagar I Part of Das Para of Nama Para,????????  I
104215,Rajibnagar,Village Panchayat,South Tripura,Satchand,757664,2,Rajibnagar II MAdhya Nath Para Das Para and Ashram Para,????????  II
104215,Rajibnagar,Village Panchayat,South Tripura,Satchand,757665,3,Rajibnagar III Nath Para and North Part of Goachand Para,????????  III
104215,Rajibnagar,Village Panchayat,South Tripura,Satchand,757666,4,Rajibnagar IV Banik Para of North Goachand Para and Das Para,????????  IV
104215,Rajibnagar,Village Panchayat,South Tripura,Satchand,757667,5,Rajibnagar V South Para of Nath Para,????????  V
104217,Satchand,Village Panchayat,South Tripura,Satchand,108801,1,Satchand I Part of Colony Para,???????? I
104217,Satchand,Village Panchayat,South Tripura,Satchand,757718,2,Satchand II Dhanu Chowdhury Para and South Part of Colony Para,???????? II
104217,Satchand,Village Panchayat,South Tripura,Satchand,757719,3,Satchand III Satchand Para and West Part of Bairagi Para,???????? III
104217,Satchand,Village Panchayat,South Tripura,Satchand,757720,4,Satchand IV Bairagi Para and Satchand Bazar Para,???????? IV
104217,Satchand,Village Panchayat,South Tripura,Satchand,757721,5,Satchand V Shalgara Para Barjala Para and North Part of Satchand Bazar Para,???????? V
104197,South Bhuratali,Village Panchayat,South Tripura,Satchand,95250,1,South Bhuratali I Jatra Mohan Para and North Part of North Para,?????? ??????? I
104197,South Bhuratali,Village Panchayat,South Tripura,Satchand,757767,2,South Bhuratali II South Part of North Para,?????? ??????? II
104197,South Bhuratali,Village Panchayat,South Tripura,Satchand,757768,3,South Bhuratali III Barjala Para Of East North Para,?????? ??????? III
104197,South Bhuratali,Village Panchayat,South Tripura,Satchand,757769,4,South Bhuratali IV South Para and West Part of Madhya Para,?????? ??????? IV
104197,South Bhuratali,Village Panchayat,South Tripura,Satchand,757770,5,South Bhuratali V Madhya Para East Part 14 Card upto Bhagaban Nath Para,?????? ??????? V
104220,Sukanta Palli,Village Panchayat,South Tripura,Satchand,120003,1,Sukanta Palli I Adarsha Para of Adarsha Palli Para,??????? ????? I
104220,Sukanta Palli,Village Panchayat,South Tripura,Satchand,757820,2,Sukanta Palli II Nama Para of South Manu Para,??????? ????? II
104220,Sukanta Palli,Village Panchayat,South Tripura,Satchand,757821,3,Sukanta Palli III Shil Para of South Manu Para,??????? ????? III
104220,Sukanta Palli,Village Panchayat,South Tripura,Satchand,757822,4,Sukanta Palli IV Kalibari Para of Lalit Para,??????? ????? IV
104220,Sukanta Palli,Village Panchayat,South Tripura,Satchand,757823,5,Sukanta Palli V Nath Para of South Manu Para,??????? ????? V
104221,Thaibung,Village Panchayat,South Tripura,Satchand,107117,1,Thaibung I Part of Singh bil Para,
104221,Thaibung,Village Panchayat,South Tripura,Satchand,757852,2,Thaibung II Nagashi Tilla and South Side of Singh Bill Para,
104221,Thaibung,Village Panchayat,South Tripura,Satchand,757853,3,Thaibung III Paul Para kaibarta Para Roy Para and Mog Para of Thaibung Para,
104221,Thaibung,Village Panchayat,South Tripura,Satchand,757854,4,Thaibung IV Madhya Para 7 Card Para and Puran Para,
104221,Thaibung,Village Panchayat,South Tripura,Satchand,757855,5,Thaibung V Thakur Para 13 Card Para 24 Card Para and Banshing Para,
104223,Vivekananda Palli,Village Panchayat,South Tripura,Satchand,81411,1,Vivekananda Palli I Shyama Prasad Para and West Part of Vivekananda Palli,?????????? ?????  I
104223,Vivekananda Palli,Village Panchayat,South Tripura,Satchand,757890,2,Vivekananda Palli II Madhya Part of Vivekananda Palli and East Part of Hari Narayanpur,?????????? ?????  II
104223,Vivekananda Palli,Village Panchayat,South Tripura,Satchand,757891,3,Vivekananda Palli III Madhya Part of Vivekananda Palli and West Part of Phanindra Nagar,?????????? ?????  III
104223,Vivekananda Palli,Village Panchayat,South Tripura,Satchand,757892,4,Vivekananda Palli IV Part of Phanindra Nagar,?????????? ?????  IV
104223,Vivekananda Palli,Village Panchayat,South Tripura,Satchand,757893,5,Vivekananda Palli V Part of Hari Narayanpur,?????????? ?????  V
104210,West Harina,Village Panchayat,South Tripura,Satchand,87874,1,West Harina I Part of Babu Gram Para and West Part of Binamadepha Para,?????? ????? I
104210,West Harina,Village Panchayat,South Tripura,Satchand,757923,2,West Harina II Part of Binamadepha and South Part of Babu Gram Para,?????? ????? II
104210,West Harina,Village Panchayat,South Tripura,Satchand,757924,3,West Harina III Part of Natun Para and East Part of Madhya Para,?????? ????? III
104210,West Harina,Village Panchayat,South Tripura,Satchand,757925,4,West Harina IV Part of Nath Para and South Part of Madhya Para,?????? ????? IV
104210,West Harina,Village Panchayat,South Tripura,Satchand,757926,5,West Harina V Part of Madhya Para North Part of Babu Gram Para and North Part of Binamadepha,?????? ????? V
104211,West Jalefa,Village Panchayat,South Tripura,Satchand,87127,1,West Jalefa I Das Palli,?????? ?????? I
104211,West Jalefa,Village Panchayat,South Tripura,Satchand,758045,2,West Jalefa II Garjan Tilla,?????? ?????? II
104211,West Jalefa,Village Panchayat,South Tripura,Satchand,758046,3,West Jalefa III Ramjee Para of Ramjee Roaza Para,?????? ?????? III
104211,West Jalefa,Village Panchayat,South Tripura,Satchand,758047,4,West Jalefa IV Madhya Para of West Jalefa Proper,?????? ?????? IV
104211,West Jalefa,Village Panchayat,South Tripura,Satchand,758048,5,West Jalefa V Mahim Doctor Para High School Para,?????? ?????? V
104212,West Sabroom,Village Panchayat,South Tripura,Satchand,97040,1,West Sabroom I Prasannya Roaja Para,?????? ??????? I
104212,West Sabroom,Village Panchayat,South Tripura,Satchand,758100,2,West Sabroom II Chandranath and Part of Pio Mog Para,?????? ??????? II
104212,West Sabroom,Village Panchayat,South Tripura,Satchand,758101,3,West Sabroom III Chandranath and Part of Modan Mohan Palli,?????? ??????? III
104212,West Sabroom,Village Panchayat,South Tripura,Satchand,758102,4,West Sabroom IV Das Para,?????? ??????? IV
104212,West Sabroom,Village Panchayat,South Tripura,Satchand,758103,5,West Sabroom V Madan Mohan Palli Para,?????? ??????? V
103970,Bilashpur,Village Panchayat,Unakoti,Chandipur,96650,1,Bilaspur I Part of Habiganja Para,???????? I ??????? ???I ???
103970,Bilashpur,Village Panchayat,Unakoti,Chandipur,767164,2,Bilashpur II Part of Habiganja Para and Part of Bilashpur,???????? II ??????? ???I ??? ??? ???????? ???
103970,Bilashpur,Village Panchayat,Unakoti,Chandipur,767165,3,Bilashpur III Part of Bilaspur,???????? III ???????? ???
103970,Bilashpur,Village Panchayat,Unakoti,Chandipur,767166,4,Bilashpur IV Part of Bilaspur and Naya Para Part of Pechardahar,???????? IV ???????? ??? ??? ??? ???I ???????? ???
103970,Bilashpur,Village Panchayat,Unakoti,Chandipur,767167,5,Bilashpur V Naya Para Part of Pechardahar and Part of Datta Para,???????? V ??? ???I ???????? ??? ??? ???? ???I ???
103970,Bilashpur,Village Panchayat,Unakoti,Chandipur,767168,6,Bilashpur VI Nadia Para and Part of Balehar of Datta Para,???????? VI ??????? ????? ? ???? ????? ?? ????? ???
103971,Birchandra Nagar,Village Panchayat,Unakoti,Chandipur,767203,1,Birchandranagar I West part of Kaluacherra,???????????? I ???????? ?????? ???
103971,Birchandra Nagar,Village Panchayat,Unakoti,Chandipur,767204,2,Birchandranagar II East part of Kaluacherra Rudrapaul Para Malakar Para and Maithei Para,???????????? II ???????? ???????? ???????? ??????? ????? ? ?????? ???????? ????? ???
103971,Birchandra Nagar,Village Panchayat,Unakoti,Chandipur,767205,3,Birchandranagar III Maithei Para,???????????? III ?????? ????
103971,Birchandra Nagar,Village Panchayat,Unakoti,Chandipur,767206,4,Birchandranagar IV North Part of Dalugaon Manipuri Para Malakar Para and Dalugaon Bazar,???????????? IV ??????? ??????? ????? ??????? ????? ? ??????? ????? ????? ?????
103971,Birchandra Nagar,Village Panchayat,Unakoti,Chandipur,767207,5,Birchandranagar V South Part of Dalugaon Bazar,???????????? V ??????? ????? ?????? ?????
103971,Birchandra Nagar,Village Panchayat,Unakoti,Chandipur,767208,6,Birchandranagar VI South Part of Dalugaon Bazar and South Part of Manipuri Para Sabdakar Para,???????????? VI ??????? ????? ?????? ???????? ?? ??????? ????? ? ?????? ????? ?????? ?????
103972,Chandipur,Village Panchayat,Unakoti,Chandipur,94787,1,Chandipur I West Chandipur and Chaitanya Goala Para,???????? I ?????? ???????? ??? ?????? ?????? ????
103972,Chandipur,Village Panchayat,Unakoti,Chandipur,767324,2,Chandipur II Part of Madhya Chandipur,???????? II ???? ???????? ???
103972,Chandipur,Village Panchayat,Unakoti,Chandipur,767325,3,Chandipur III Part of Madhya Chandipur,???????? III ???? ???????? ???
103972,Chandipur,Village Panchayat,Unakoti,Chandipur,767326,4,Chandipur IV Akta Para,???????? IV ???? ????
103972,Chandipur,Village Panchayat,Unakoti,Chandipur,767327,5,Chandipur V Part of South Chandipur,???????? V ?????? ???????? ???
103972,Chandipur,Village Panchayat,Unakoti,Chandipur,767328,6,Chandipur VI Part of South Chandipur,???????? VI ?????? ???????? ???
103973,Chantail,Village Panchayat,Unakoti,Chandipur,767382,1,Chantail I North Chantail,??????? I ????? ???????
103973,Chantail,Village Panchayat,Unakoti,Chandipur,767383,2,Chantail II Muslim Pally and Part of Ranirghat,??????? II? ?????? ????? ??? ???????? ???
103973,Chantail,Village Panchayat,Unakoti,Chandipur,767384,3,Chantail III Middle Chantail and Mitra Para,??????? III ???? ??????? ??? ????? ???
103973,Chantail,Village Panchayat,Unakoti,Chandipur,767385,4,Chantail IV Part of Baraitali and Part of Ranirghat,??????? IV ?????? ??? ??? ???????? ???
103973,Chantail,Village Panchayat,Unakoti,Chandipur,767386,5,Chantail V Part of Sova Baraitaliagan and North South Part of Halaibasti,??????? V ?????? ???? ????? ??? ??? ????????? ????? ?????? ???
103973,Chantail,Village Panchayat,Unakoti,Chandipur,767387,6,Chantail VI West of west Para Halambasti and North South part of Halambasti,??????? VI ?????? ?????? ????? ????????? ??? ????????? ????? ?????? ???
103974,Dhanbilash,Village Panchayat,Unakoti,Chandipur,767408,1,Dhanbilash I Part of Bhagyapur and Sabdakar Para Part of Debipur,??????? I ???????? ??? ??? ?????? ???I ??????? ???
103974,Dhanbilash,Village Panchayat,Unakoti,Chandipur,767409,2,Dhanbilash II Part of Bhagyapur,??????? II ???????? ???
103974,Dhanbilash,Village Panchayat,Unakoti,Chandipur,767410,3,Dhanbilash III Part of Bhagyapur and Sabdakar Para Part of Debipur,??????? III ???????? ??? ??? ?????? ???I ??????? ???
103974,Dhanbilash,Village Panchayat,Unakoti,Chandipur,767411,4,Dhanbilash IV Sabdakar Para of Debipur and Terapasha Part,??????? IV ?????? ???I ??????? ??? ??? ???????? ???
103974,Dhanbilash,Village Panchayat,Unakoti,Chandipur,767412,5,Dhanbilash V Part of Terapasha East Manipuri Para Part of Dhanbilas and Vikaroy Para,??????? V ???????? ??? ????? ??????? ????? ??????? ??? ??? ?????? ?????
103974,Dhanbilash,Village Panchayat,Unakoti,Chandipur,767413,6,Dhanbilash VI Shibbari Sabdakarpara of Debipur and West Manipuri Para of Dhanbilash,??????? VI ??????? ??? ?????? ???I ??? ??????? ?????? ??????? ?????
103976,Fultali,Village Panchayat,Unakoti,Chandipur,767499,1,Fultali I West Fultali of Fultali,?????? I ?????? ?????? ??????
103976,Fultali,Village Panchayat,Unakoti,Chandipur,767500,2,Fultali II Madhya Fultali Part of Fultali,?????? II ?????? ?? ???? ?????? ???
103976,Fultali,Village Panchayat,Unakoti,Chandipur,767501,3,Fultali III East Fultali of Fultali,?????? III ?????? ????? ??????
103976,Fultali,Village Panchayat,Unakoti,Chandipur,767502,4,Fultali IV Madhya Fultali Part of Fultali,?????? IV ?????? ?? ???? ?????? ???
103976,Fultali,Village Panchayat,Unakoti,Chandipur,767503,5,Fultali V South Fultali of Fultali,?????? V ?????? ?????? ??????
261227,Halairpar,Village Panchayat,Unakoti,Chandipur,767540,1,Halairpar I Part of West Kinairchar,????????? I ?????? ?????????? ???
261227,Halairpar,Village Panchayat,Unakoti,Chandipur,767541,2,Halairpar II Part of West Kinairchar,????????? II ?????? ?????????? ???
261227,Halairpar,Village Panchayat,Unakoti,Chandipur,767542,3,Halairpar III Part of Halairpar,????????? III ??????? ???
261227,Halairpar,Village Panchayat,Unakoti,Chandipur,767543,4,Halairpar IV Part of Halairpar,????????? IV ??????? ???
261227,Halairpar,Village Panchayat,Unakoti,Chandipur,767544,5,Halairpar V Part of Halairpar,????????? V ??????? ???
103982,Jarultali,Village Panchayat,Unakoti,Chandipur,767812,1,Jarultali I Halaibasti of Katauni,???????? I ?????? ?? ?????????
103982,Jarultali,Village Panchayat,Unakoti,Chandipur,767813,2,Jarultali II Paul Para of Mohanpur,???????? II ??????? ?? ??? ???I
103982,Jarultali,Village Panchayat,Unakoti,Chandipur,767814,3,Jarultali III Part of Kuridrone,???????? III ???????? ???
103982,Jarultali,Village Panchayat,Unakoti,Chandipur,767815,4,Jarultali IV Part of Kuridrone,???????? IV ???????? ???
103982,Jarultali,Village Panchayat,Unakoti,Chandipur,767816,5,Jarultali V Madhya Jarultali and North Jarultali,???????? V ???? ???????? ??? ????? ????????
103988,Manu Valley,Village Panchayat,Unakoti,Chandipur,767883,1,Manuvalley I Part of Hidly Bhadrapalli JibanTila Part of 14 No Tila and Bazar Line,????????? I ????? ????????? ??? ?? ?? ???? ?? ???? ???? ??? ??? ????? ????
103988,Manu Valley,Village Panchayat,Unakoti,Chandipur,767884,2,Manuvalley II Raban Tila Part of 14 No Tila,????????? II ?? ?? ???? ?? ???? ???
103988,Manu Valley,Village Panchayat,Unakoti,Chandipur,767885,3,Manuvalley III Office Tila,????????? III ???? ????
103988,Manu Valley,Village Panchayat,Unakoti,Chandipur,767886,4,Manuvalley IV Part of 14 No Tila 3 No Tila 9 and 11 Line and 17 No Line,????????? IV ?? ?? ???? ??? ? ?? ???? ? ??? ?? ???? ??? ?? ?? ???? ???
103988,Manu Valley,Village Panchayat,Unakoti,Chandipur,767887,5,Manuvalley V Mohan Digar Par of Chandipur Tea Garden Side,????????? V ???? ???? ???
103989,Murticherra,Village Panchayat,Unakoti,Chandipur,92976,1,Murticherra I 10 No Urang para,?????????? I 10 ?? ?????? ???I
103989,Murticherra,Village Panchayat,Unakoti,Chandipur,767954,2,Murticherra II Amla Tila and Kharia Tila,?????????? II ???? ???? ??? ?????? ????
103989,Murticherra,Village Panchayat,Unakoti,Chandipur,767955,3,Murticherra III Sanju Tila,?????????? III ????? ????
103989,Murticherra,Village Panchayat,Unakoti,Chandipur,767956,4,Murticherra IV UriaTila,?????????? IV ????? ????
103989,Murticherra,Village Panchayat,Unakoti,Chandipur,767957,5,Murticherra V Bazar Tila,?????????? V ????? ????
