Local Body Code,Local Body Name,Local Body Type,"District Level
Parent Name
","Intermediate Level
Parent Name",Ward Code,"Ward
Number","Ward Name
(In English)
","Ward Name
(In Local)
"
104340,North Paharpur,Village Panchayat,Sepahijala,Kathalia,764709,2,North Paharpur II Baganbari of Keyajala and Ghosh Para Baidyanath Para of Barmura East Para,????? ???????? II
104340,North Paharpur,Village Panchayat,Sepahijala,Kathalia,764710,3,North Paharpur III Betachor of Rangamura,????? ???????? III
104340,North Paharpur,Village Panchayat,Sepahijala,Kathalia,764711,4,North Paharpur IV Thammamura,????? ???????? IV
104340,North Paharpur,Village Panchayat,Sepahijala,Kathalia,764712,5,North Paharpur V West Part of Barmura West Para and South of Rangamura,????? ???????? V
104340,North Paharpur,Village Panchayat,Sepahijala,Kathalia,764713,6,North Paharpur VI East Part of Baranarayan II Colony Barmura West Para of Keyajala,????? ???????? VI
104336,Rabindranagar,Village Panchayat,Sepahijala,Kathalia,90045,1,Rabindranagar I West Part of Bejimara South,??????????? I
104336,Rabindranagar,Village Panchayat,Sepahijala,Kathalia,764813,2,Rabindranagar II East Part of Bejimara South,??????????? II
104336,Rabindranagar,Village Panchayat,Sepahijala,Kathalia,764814,3,Rabindranagar III East Part of Sanitpally,??????????? III
104336,Rabindranagar,Village Panchayat,Sepahijala,Kathalia,764815,4,Rabindranagar IV West Part of Sanitpally,??????????? IV
104336,Rabindranagar,Village Panchayat,Sepahijala,Kathalia,764816,5,Rabindranagar V West Part of North side of road from Dioscoria Farm to Bangladesh Boarder of part of Rabindranagar Sub Village,??????????? V
104336,Rabindranagar,Village Panchayat,Sepahijala,Kathalia,764817,6,Rabindranagar VI Chandikali Bari,??????????? VI
104337,Sonapur,Village Panchayat,Sepahijala,Kathalia,107629,1,Sonapur I Shingerpara and West Part of Murapara,??????? I
104337,Sonapur,Village Panchayat,Sepahijala,Kathalia,764915,2,Sonapur II Bettarpar and Murapara East Part of Dighirpar,??????? II
104337,Sonapur,Village Panchayat,Sepahijala,Kathalia,764916,3,Sonapur III East Part of Shyamarkona and Sarddarbari,??????? III
104337,Sonapur,Village Panchayat,Sepahijala,Kathalia,764917,4,Sonapur IV Paharpur and West Part of Shyamarkona,??????? IV
104337,Sonapur,Village Panchayat,Sepahijala,Kathalia,764918,5,Sonapur V Surja Nagar of Khash Sonapur and South Part of Murapara,??????? V
104328,South Maheshpur,Village Panchayat,Sepahijala,Kathalia,103934,1,South Maheshpur I Ghosh Para and South Part of Madhya Para,?????? ??????? I
104328,South Maheshpur,Village Panchayat,Sepahijala,Kathalia,764978,2,South Maheshpur II Forest Office Para of North Part of Master Para,?????? ??????? II
104328,South Maheshpur,Village Panchayat,Sepahijala,Kathalia,764979,3,South Maheshpur III Part of Master Para,?????? ??????? III
104328,South Maheshpur,Village Panchayat,Sepahijala,Kathalia,764980,4,South Maheshpur IV BalaramerKhamar Bari and Barbari and Colony Para of South Maheshpur,?????? ??????? IV
104328,South Maheshpur,Village Panchayat,Sepahijala,Kathalia,764981,5,South Maheshpur V Landless Colony of Kaiyatilla,?????? ??????? V
104328,South Maheshpur,Village Panchayat,Sepahijala,Kathalia,764982,6,South Maheshpur VI Refuji Para,?????? ??????? VI
104329,South Paharpur,Village Panchayat,Sepahijala,Kathalia,98667,1,South Paharpur I West Part of Tetuiyamura,?????? ???????? I
104329,South Paharpur,Village Panchayat,Sepahijala,Kathalia,765019,2,South Paharpur II North Part of Lemnamura Ludhuamura and East Part Shalkhet of Tetuiyamura,?????? ???????? II
104329,South Paharpur,Village Panchayat,Sepahijala,Kathalia,765020,3,South Paharpur III Nayatilla of Barkhala,?????? ???????? III
104329,South Paharpur,Village Panchayat,Sepahijala,Kathalia,765021,4,South Paharpur IV Gowamura and South Part of Lemnamura,?????? ???????? IV
104329,South Paharpur,Village Panchayat,Sepahijala,Kathalia,765022,5,South Paharpur V South Para of Machima and Paduarpara,?????? ???????? V
104329,South Paharpur,Village Panchayat,Sepahijala,Kathalia,765023,6,South Paharpur VI North Para of Machima,?????? ???????? VI
104338,Sovapur,Village Panchayat,Sepahijala,Kathalia,107810,1,Sovapur I West Para of Sovapur West Part of Nama Para and West Part of South side of road passes from Dioscoria Farm to Bangladesh Boarder of Part of Rabindranagar Sub Village,??????? I
104338,Sovapur,Village Panchayat,Sepahijala,Kathalia,765133,2,Sovapur II East Para of Palpara Part of Nama Para and East Part of South side of road passes from Dioscoria Farm to Bangladesh Boarder of Part of Rabindranagar Sub Village,??????? II
104338,Sovapur,Village Panchayat,Sepahijala,Kathalia,765134,3,Sovapur III Mekli Para and Eastern South Part of Sovapur,??????? III
104338,Sovapur,Village Panchayat,Sepahijala,Kathalia,765135,4,Sovapur IV Western North Part of Mag Pukur Para of Sovapur,??????? IV
104338,Sovapur,Village Panchayat,Sepahijala,Kathalia,765136,5,Sovapur V Killamura,??????? V
104338,Sovapur,Village Panchayat,Sepahijala,Kathalia,765137,6,Sovapur VI Sahapur,??????? VI
261283,Srimantapur,Village Panchayat,Sepahijala,Kathalia,765163,1,Srimantapur I Srimantapur of Katak Bazar,??????????? I
261283,Srimantapur,Village Panchayat,Sepahijala,Kathalia,765164,2,Srimantapur II North Part of Mura Para of Srimantapur South,??????????? II
261283,Srimantapur,Village Panchayat,Sepahijala,Kathalia,765165,3,Srimantapur III South Part of Rabindranagar Para of Srimantapur South,??????????? III
261283,Srimantapur,Village Panchayat,Sepahijala,Kathalia,765166,4,Srimantapur IV Bhogjor,??????????? IV
261283,Srimantapur,Village Panchayat,Sepahijala,Kathalia,765167,5,Srimantapur V Tangir Ghat,??????????? V
261279,Baniachara,Village Panchayat,Sepahijala,Mohanbhog,761267,1,Baniachara I North Part of Bardhepa Para,????????? I
261279,Baniachara,Village Panchayat,Sepahijala,Mohanbhog,761268,2,Baniachara II Sarkar Para West Part of Kemper Tilla Para and Das Para,????????? II
261279,Baniachara,Village Panchayat,Sepahijala,Mohanbhog,761269,3,Baniachara III Bania Chara Para and East Part of Kemper Tilla Para,????????? III
261279,Baniachara,Village Panchayat,Sepahijala,Mohanbhog,761270,4,Baniachara IV Jharjharia Para and Kukia Chara Para,????????? IV
261279,Baniachara,Village Panchayat,Sepahijala,Mohanbhog,761271,5,Baniachara V Fajaler Rahaman Para,????????? V
104387,East Chandigarh,Village Panchayat,Sepahijala,Mohanbhog,95001,1,East Chandigarh I Hrishi Para and North Part of Ghila Mura,????? ??????? I
104387,East Chandigarh,Village Panchayat,Sepahijala,Mohanbhog,761272,2,East Chandigarh II South Part of Ghila Mura,????? ??????? II
104387,East Chandigarh,Village Panchayat,Sepahijala,Mohanbhog,761273,3,East Chandigarh III 76 Colony Saheber Jum of Kamala Bagan and North Part of Kalapania,????? ??????? III
104387,East Chandigarh,Village Panchayat,Sepahijala,Mohanbhog,761274,4,East Chandigarh IV South Part of Kalapania and Deb Para,????? ??????? IV
104387,East Chandigarh,Village Panchayat,Sepahijala,Mohanbhog,761275,5,East Chandigarh V Sarkar Para,????? ??????? V
104387,East Chandigarh,Village Panchayat,Sepahijala,Mohanbhog,761276,6,East Chandigarh VI Baitta Colony of Muslim Para Tribal Para and ONGC Para,????? ??????? VI
104372,Grantali,Village Panchayat,Sepahijala,Mohanbhog,94396,1,Grantali I North Part of Garur Bandh,???????? I
104372,Grantali,Village Panchayat,Sepahijala,Mohanbhog,761290,2,Grantali II Middle Part of Garur Bandh,???????? II
104372,Grantali,Village Panchayat,Sepahijala,Mohanbhog,761291,3,Grantali III Kalamkhet North of Kalamkhet Rasaraj Das Para,???????? III
104372,Grantali,Village Panchayat,Sepahijala,Mohanbhog,761292,4,Grantali IV Kalamkhet South of Kalamkhet Bimal Sarkar Para,???????? IV
104372,Grantali,Village Panchayat,Sepahijala,Mohanbhog,761293,5,Grantali V South Part of Kathalia Mura,???????? V
104372,Grantali,Village Panchayat,Sepahijala,Mohanbhog,761294,6,Grantali VI Malin Mohan Das Para of North Part of Kathalia Mura and West Para of Garur Bandh Mahoram Ali Para,???????? VI
261280,Kalamkhet,Village Panchayat,Sepahijala,Mohanbhog,761345,1,Kalamkhet I Kalamkhet West Para,???????? I
261280,Kalamkhet,Village Panchayat,Sepahijala,Mohanbhog,761346,2,Kalamkhet II Kalamkhet East Para,???????? II
261280,Kalamkhet,Village Panchayat,Sepahijala,Mohanbhog,761347,3,Kalamkhet III Kalamkhet South Para and Kalamkhet Khamar,???????? III
261280,Kalamkhet,Village Panchayat,Sepahijala,Mohanbhog,761348,4,Kalamkhet IV Barpathar Para Barpathar East Para and Barpathar West Para,???????? IV
261280,Kalamkhet,Village Panchayat,Sepahijala,Mohanbhog,761349,5,Kalamkhet V North Part of Urmai East Para,???????? V
104375,Kamrangatali,Village Panchayat,Sepahijala,Mohanbhog,101118,1,Kamrangatali I West Para,???????????? I
104375,Kamrangatali,Village Panchayat,Sepahijala,Mohanbhog,761438,2,Kamrangatali II South Para,???????????? II
104375,Kamrangatali,Village Panchayat,Sepahijala,Mohanbhog,761439,3,Kamrangatali III Madhya Para,???????????? III
104375,Kamrangatali,Village Panchayat,Sepahijala,Mohanbhog,761440,4,Kamrangatali IV East Para,???????????? IV
104375,Kamrangatali,Village Panchayat,Sepahijala,Mohanbhog,761441,5,Kamrangatali V East South Para,???????????? V
104381,Mohanbhog,Village Panchayat,Sepahijala,Mohanbhog,108712,1,Mohanbhog I West Mohanbhog of Mohanbhog Bazar Para,??????? I
104381,Mohanbhog,Village Panchayat,Sepahijala,Mohanbhog,761490,2,Mohanbhog II Jirtali Bazar Para,??????? II
104381,Mohanbhog,Village Panchayat,Sepahijala,Mohanbhog,761491,3,Mohanbhog III Mohanbhog Madhya Para,??????? III
104381,Mohanbhog,Village Panchayat,Sepahijala,Mohanbhog,761492,4,Mohanbhog IV Mohanbhog Madhya North Para,??????? IV
104381,Mohanbhog,Village Panchayat,Sepahijala,Mohanbhog,761493,5,Mohanbhog V East Mohanbhog of Mohanbhog East Para,??????? V
104397,Telkajla,Village Panchayat,Sepahijala,Mohanbhog,106185,1,Telkajla I Saheb Ali Para,???????? I
104397,Telkajla,Village Panchayat,Sepahijala,Mohanbhog,761547,2,Telkajla II Madhya Para and Char Para,???????? II
104397,Telkajla,Village Panchayat,Sepahijala,Mohanbhog,761548,3,Telkajla III Panchayat Para and South Part of Bardhepa Para,???????? III
104397,Telkajla,Village Panchayat,Sepahijala,Mohanbhog,761549,4,Telkajla IV Srimati Para,???????? IV
104397,Telkajla,Village Panchayat,Sepahijala,Mohanbhog,761550,5,Telkajla V SC Colony Para and West Para,???????? V
104397,Telkajla,Village Panchayat,Sepahijala,Mohanbhog,761551,6,Telkajla VI Kala Miah Para Ajghar Ali Para and Niyadaniya Mura Para,???????? VI
104398,Urmai,Village Panchayat,Sepahijala,Mohanbhog,80778,1,Urmai i Prabodh Bhowmiks Para Kalamkhet SC Para and Urmai North Para,?????? I
104398,Urmai,Village Panchayat,Sepahijala,Mohanbhog,761680,2,Urmai II South Part of Urmai East Para,?????? II
104398,Urmai,Village Panchayat,Sepahijala,Mohanbhog,761681,3,Urmai III Urmai West Para and Karai Mura,?????? III
104398,Urmai,Village Panchayat,Sepahijala,Mohanbhog,761682,4,Urmai IV Santi Mura,?????? IV
104398,Urmai,Village Panchayat,Sepahijala,Mohanbhog,761683,5,Urmai V Bengulia,?????? V
104398,Urmai,Village Panchayat,Sepahijala,Mohanbhog,761684,6,Urmai VI Gabariya Dhepa,?????? VI
104364,Bagabasa,Village Panchayat,Sepahijala,Nalchar,98476,1,Bagabasa I Tribal Para and Part of West Para Consisting of Kachigang on North and West Side East Nalchar Road on South and Paddy Land Field on East Side,??????? I
104364,Bagabasa,Village Panchayat,Sepahijala,Nalchar,766602,2,Bagabasa II West Part of South Para and Part of Tribal Para Consisting of PWD Road on North Side Shilghati on South ST para Road on West Side Totabarai on East Side,??????? II
104364,Bagabasa,Village Panchayat,Sepahijala,Nalchar,766603,3,Bagabasa III Part of West Para Consisting of Laxmandhepa Gram on North Side PWD Road on South East Nalchar Gram on West and Rajibnagar Road on East Side,??????? III
104364,Bagabasa,Village Panchayat,Sepahijala,Nalchar,766604,4,Bagabasa IV East Part of South Para and Part of Madhya Para Consisting of PWD Road on north Totabari Road on South Craft Village Road on West and Tepania Block on East,??????? IV
104364,Bagabasa,Village Panchayat,Sepahijala,Nalchar,766605,5,Bagabasa V Part of Madhya Para Consisting of Rajibnagar Gram on North PWD Road on South Rajibnagar Road on West and Rajibnagar Chhara on East Side,??????? V
104364,Bagabasa,Village Panchayat,Sepahijala,Nalchar,766606,6,Bagabasa VI East Para Consisting on Rajibnagar Gram on North Kachigang on South Rajibnagar Chhara on West and East Bagabasa on East Side,??????? VI
104365,Bordwal,Village Panchayat,Sepahijala,Nalchar,89448,1,Bordwal I Munshimura Consisting of House of Jantur Ali on North Side House of Abdul Malek on South Side House of Santosh Debnath on West Side House of Selim Khandakar on East Side,??????? I
104365,Bordwal,Village Panchayat,Sepahijala,Nalchar,766705,2,Bordwal II Bagaiamura and Madhya Para Consisting of Muslem Uddin Maishan House on North Side Rejjak Miah House on South Side Uttam Majumder Bari House on West Side and Atul Das House East Side,??????? II
104365,Bordwal,Village Panchayat,Sepahijala,Nalchar,766706,3,Bordwal III Mulla Para Mannayan Miah House on North Side Muklesur Rahaman House on South Side Uttam Majumder Bari on West Side and Atul Das House on East Side,??????? III
104365,Bordwal,Village Panchayat,Sepahijala,Nalchar,766707,4,Bordwal IV Uthamura and Bariamura Billal iah Kaji on North Side Abdul Khayuer on South Side Abdul Khalek House on West Side Uthamura Masjid on East Side,??????? IV
104365,Bordwal,Village Panchayat,Sepahijala,Nalchar,766708,5,Bordwal V South Majumder Para and Tipramura Para Consisting of Jaynal Miah House on North Side Abdul Rahamana House on South Side Rashid Miah on West Side and Alamgir Majumder on East Side,??????? V
104367,Chandanmura,Village Panchayat,Sepahijala,Nalchar,117534,1,Chandanmura I Sahebmura Consisting of House o Manurangan Das on North Side Rudrasagar on South Side Niranjan Das House on East Side and Sadhan Das on West Side,????????? I
104367,Chandanmura,Village Panchayat,Sepahijala,Nalchar,766803,2,Chandanmura II West Para and West Part of Chandanmura Para Consisting of Direndra Barman House on North Side Rabindra Das House on South Side Chandanmura High Scgool Field on East Side and Bimal Das on West Side,????????? II
104367,Chandanmura,Village Panchayat,Sepahijala,Nalchar,766804,3,Chandanmura III Kachirpar Para Consisting of Tapan Das House on North Side Gopal Chandra Barman on South Side Sudhrr Das Hose on East Side and Tari Bibi House on West Side,????????? III
104367,Chandanmura,Village Panchayat,Sepahijala,Nalchar,766805,4,Chandanmura IV Battali Madhya Para Consisting of Payari Mohan Das on North Side Gomati River on South Sdie Barun Saha House on East Side Battali SB School on West Side,????????? IV
104367,Chandanmura,Village Panchayat,Sepahijala,Nalchar,766806,5,Chandanmura V Lengta Dargapara Consisting of Tapan Das House on North Side Ratan Ch Sarkar on South Side Narayan Barman House on East Side Pera Miah house on West Side,????????? V
104367,Chandanmura,Village Panchayat,Sepahijala,Nalchar,766807,6,Chandanmura VI East Para and East Part of Chandanmura Para Consisting of Manik DAs House on North Side Premanada Barman on South Side Mati Lal Das on East Side and Chandanmura High School field on West Side,????????? VI
104369,Chowmuhani,Village Panchayat,Sepahijala,Nalchar,105848,1,Chowmuhani I West Part of West Para and West Part of Fakiramura Consisting of Santosh Debanath House on North Side Sadhan Das on South Taijling Gram on West and West Para of East Part on East Side,??????? I
104369,Chowmuhani,Village Panchayat,Sepahijala,Nalchar,766900,2,Chowmuhani II East Part of West Para and Chowmuhani Para Consisting of Kumariakucha Gram on North Side Madhyapara on South Side West Part of West Para on West and Baniamuara on East Side,??????? II
104369,Chowmuhani,Village Panchayat,Sepahijala,Nalchar,766902,3,Chowmuhani III East Part of Fakiramura Madhya Para and Panchayat Tilla,??????? III
104369,Chowmuhani,Village Panchayat,Sepahijala,Nalchar,766904,4,Chowmuhani IV Kathaliamura Consisting of Fakiramura and Chowmuhani Bazar on North Side Kemtali Gram on South Side Suresh Das House on West and West Nalchar and Kemtali Gram on East Side,??????? IV
104369,Chowmuhani,Village Panchayat,Sepahijala,Nalchar,766906,5,Chowmuhani V South Part of Purba Para,??????? V
104369,Chowmuhani,Village Panchayat,Sepahijala,Nalchar,766908,6,Chowmuhani VI North Part of Purba Para and Baniamura,??????? VI
104388,East Durlovnarayan,Village Panchayat,Sepahijala,Nalchar,89012,1,East Durlovnarayar I Shikaribari Para comprising of Khas Chowmuhani on North Side Durlovnarayan Bazar on South Side West Durlovnarayan on West Side and Kalibari on East Side,????? ???????????? I
104388,East Durlovnarayan,Village Panchayat,Sepahijala,Nalchar,766950,2,East Durlovnarayan II Kaillamura Ghosh Para Saha Para of Kabillyadam comprising of Khas Chowmuhani on North Side Chhara on South Side Kalibari on West Side and Bamnimura on East Side,????? ???????????? II
104388,East Durlovnarayan,Village Panchayat,Sepahijala,Nalchar,766951,3,East Durlovnarayan III Bamnimura comprising of Khas Chowmuhani GP on North Side Rudhijala on South Side Bamnimura AWC on West Side and Kemtali GP on East Side,????? ???????????? III
104388,East Durlovnarayan,Village Panchayat,Sepahijala,Nalchar,766952,4,East Durlovnarayan IV Kechamura Jayasta Ram Para of Garjan Tilla Part comprising of Kalibarai Road on North Side Garjan Tilla on South Side West Durlovnarayan on West Side and Rudrasagar on East Side,????? ???????????? IV
104388,East Durlovnarayan,Village Panchayat,Sepahijala,Nalchar,766953,5,East Durlovnarayan V Kata Gang Chowan Basat of Kechamura Part comprising of Jayasta Ram Para on North Side Chandan mura GP on South Side Bordowal GP on West Side and Rudrasagar on East Side,????? ???????????? V
104388,East Durlovnarayan,Village Panchayat,Sepahijala,Nalchar,766954,6,East Durlovnarayan VI Garjan Tilla Part comprising of Jatyasta Ram Para on North side Bordowal GP Main Road East Durlovnarayan Bordowal on West Side and Katagang on East Side,????? ???????????? VI
104390,East Nalchar,Village Panchayat,Sepahijala,Nalchar,82058,1,East Nalchar I Madhya Para Madhyapara PWD Road on North Side Nalchar High School on South Side Agartala Sonamura PWD Road on West Side and Agri Firm on Easr Side,????? ???? I
104390,East Nalchar,Village Panchayat,Sepahijala,Nalchar,767031,2,East Nalchar II Panchayat Para Consisting of East Nalchar Panchayat office on North Side South Nalchar GP Border on Soiuth Side Atul Ch ECO PARK on East Side and Nalchar Mohanbhog Road on West Side,????? ???? II
104390,East Nalchar,Village Panchayat,Sepahijala,Nalchar,767032,3,East Nalchar III Baramura Para Consisting of Shil Bari to NBCC Road on North Side Baramura JB School on South Side Kalibari on West Side RPS Office on East Side,????? ???? III
104390,East Nalchar,Village Panchayat,Sepahijala,Nalchar,767033,4,East Nalchar IV Kajirdon Consisting of Cherra Nalchar Kachigang to Jagadish Das House on North Side South Nalchar GP Border on South Side Agri Firm on East Side Ongc to Sridam Nama house on West Side,????? ???? IV
104390,East Nalchar,Village Panchayat,Sepahijala,Nalchar,767034,5,East Nalchar V Schoolpara Noacherra on North Side Agri Quarter on South Side Kalibari on East Side Nalchar High School on West Side,????? ???? V
104390,East Nalchar,Village Panchayat,Sepahijala,Nalchar,767035,6,East Nalchar VI Maishanbaripara Consisting of East Nalchar Laxmandhepa Road on North Side Sluice Gate on South Side Kalibari on East Side Samatalpara AWC on West Side,????? ???? VI
104390,East Nalchar,Village Panchayat,Sepahijala,Nalchar,767036,7,East Nalchar VII Killamurapara Consisting of Tut Bagan on North Side Kachigang on South Side Nalchar Bagabasa Road to Tutbagan on East Side and Agartala Sonamura PWD Road on West Side,????? ???? VII
104374,Jumerdhapa,Village Panchayat,Sepahijala,Nalchar,116624,1,Jumerdhapa I Shil Colony and Bhowmik Para comprising of Kaliram ADC Village on North Side Muslim Para near Subash D Nath House Agartala Sonamura Road on East Side and Kumariakucha GP Border on West Side,????????? I
104374,Jumerdhapa,Village Panchayat,Sepahijala,Nalchar,767127,2,Jumerdhapa II Bidya Bashi Para and Baisnabcharan Para comprising of Bhowmik Para near Charu Blala D Nath house on North Side Jumerdhapa and Mayarani Road on South Side Jumerdhapa High School on East Side and Chowmohani GP Border on West Side,????????? II
104374,Jumerdhapa,Village Panchayat,Sepahijala,Nalchar,767128,3,Jumerdhapa III Muslim Para and Thakurpara of East Part of Bhowmikpara comprising of Shil Colony Gopimohan D Nath Agri Land on North Side House of Nepalsukla Das on South Side Ramthakurasram and Agt SNM Road and West Jumerdhapa Highschool on West Side,????????? III
104374,Jumerdhapa,Village Panchayat,Sepahijala,Nalchar,767129,4,Jumerdhapa IV Radhanath Chowdhuri Para School Para and South Part of Bazar Para comprising of Agriland on North Side Westnalchar GP Border on South Side Agartala Sonamuraroad on East Side and Chowmohani GP Border near Gopal Bhowmik house on West Side,????????? IV
104374,Jumerdhapa,Village Panchayat,Sepahijala,Nalchar,767130,5,Jumerdhapa V Harimohan Shil Tilla and North Part of East Bairagi Bazaar Para,????????? V
104374,Jumerdhapa,Village Panchayat,Sepahijala,Nalchar,767131,6,Jumerdhapa VI Manikumar Para and South Part of East Bairagi Bazarpara,????????? VI
104376,Kemtali,Village Panchayat,Sepahijala,Nalchar,116881,1,Kemtali I Baidermura I comprising of Chowmuhani GP Border on North Side Barakmura on South Side Baidermura on West Side and West Nalchar GP Border on East Side,?????? I
104376,Kemtali,Village Panchayat,Sepahijala,Nalchar,767403,2,Kemtali II Baidermura II comprising of Chowmuhani GP Border on North Side Kemtali on South Side East Durlav Narayan GP Border on West Side and Baidermura I on East Side,?????? II
104376,Kemtali,Village Panchayat,Sepahijala,Nalchar,767404,3,Kemtali III Barakmura comprising of Baidermura on North Side Rudhijala on South Side Kemtali on West Side and South Nalchar GP border on East Side,?????? III
104376,Kemtali,Village Panchayat,Sepahijala,Nalchar,767405,4,Kemtali IV Lethamura comprising of Kemtali GP on North Side Rudhijala on South Side Rajendranagar on West Side and Barakmura on East Side,?????? IV
104376,Kemtali,Village Panchayat,Sepahijala,Nalchar,767406,5,Kemtali V Kemtali comprising of Baidermura II on North Side Lethamura on South Side Rajendranagar on West Side and Barakmura on East Side,?????? V
104376,Kemtali,Village Panchayat,Sepahijala,Nalchar,767407,6,Kemtali VI Rajendranagar comprising of Kemtali GP on North Side Rudrasagar on South Side East Durlabnarayan GP Border on West Side and Lethamura on East Side,?????? VI
104377,Khas Chowmuhani,Village Panchayat,Sepahijala,Nalchar,106419,1,Khas Chowmuhani I Uttar Para comprising of Rabigopal Para on North Side Thakur Para on South Side Thakur Para on West Side and Nathuram Chowdhuri Para on East Side,??? ??????? I
104377,Khas Chowmuhani,Village Panchayat,Sepahijala,Nalchar,767495,2,Khas Chowmuhani II Nathuram Chowdhuri Para comprising of Rabigopal Para on North Side East Para on South Side North Para on West Side and Chowmohani G P border on East Side,??? ??????? II
104377,Khas Chowmuhani,Village Panchayat,Sepahijala,Nalchar,767496,3,Khas Chowmuhani III Purba Para and Madhyapara comprising of Nathuram Chowmuhani Para on North Side Ghosh Para on South Side North Para on West Side and Chowmohani G P border on East Side,??? ??????? III
104377,Khas Chowmuhani,Village Panchayat,Sepahijala,Nalchar,767497,4,Khas Chowmuhani IV Thakur Para comprising of Uttar Para on North Side East Durlovnarayan GP border on South Side Ghosh Para on West Side and West Durlovnarayan G P border on East Side,??? ??????? IV
104377,Khas Chowmuhani,Village Panchayat,Sepahijala,Nalchar,767498,5,Khas Chowmuhani V Ghosh Para comprising of East Para on North Side East Durlavnarayan GP Border on South Side Thakur Para on West Side and Kemtali G P Border on East Side,??? ??????? V
104378,Khedabari,Village Panchayat,Sepahijala,Nalchar,90620,1,Khedabari I Jolaibari comprising of Karanir Dhon on North Side PWD Road on South Side House of Jalfu Miah on West Side and House of Abul Kalam on East Side,???????? I
104378,Khedabari,Village Panchayat,Sepahijala,Nalchar,767584,2,Khedarbari II Police Para comprising of Deayer Dhon on North Side Masjid on South Side 79 Tilla on West Side and House of Muklesh Maih on East Side,???????? II
104378,Khedabari,Village Panchayat,Sepahijala,Nalchar,767585,3,Khedarbari III Paschim Para and ONGC Coloney of Purba Para comprising of House of Parimal Majumder and Kabar Khala on North Side PWD Road on South Side West Road on West and House of Monohar Bhowmik on East Side,???????? III
104378,Khedabari,Village Panchayat,Sepahijala,Nalchar,767586,4,Khedarbari IV West Part of Dakshin Para comprising of PWD Road on North Side Padmadhepa on South Paddy land on West Side and NBCC Road on East Side,???????? IV
104378,Khedabari,Village Panchayat,Sepahijala,Nalchar,767587,5,Khedarbari V East Part of Dakshin Para Comprising of House of Dulal Bhowmik on North Side House of Dinesh Majumder on South Side NBCC Road on West Side and Paddy Land on East Side,???????? V
104379,Kumariakucha,Village Panchayat,Sepahijala,Nalchar,87354,1,Kumariakucha I Bagmara Para and Shil Para comprising of Bisharamganj Taxapara PWD Road on North Side SC Colony Road on South Side Padmininagar ADC Village border on West Side and Bagmara SB School on East Side,???????????? I
104379,Kumariakucha,Village Panchayat,Sepahijala,Nalchar,767632,2,Kumariakucha II SC Colony and Khash Tilla Para comprising of Padmanagar ADC Village Border on North Side House of Nagendra Das of Khash Tilla Kali Bari on South Side East Part of Madhya Para on West Side and Kalliram ADC Village Border on East Side,???????????? II
