Local Body Code,Local Body Name,Local Body Type,"District Level
Parent Name
","Intermediate Level
Parent Name",Ward Code,"Ward
Number","Ward Name
(In English)
","Ward Name
(In Local)
"
103935,Basudeb Para,Village Panchayat,Dhalai,Ambassa,105247,1,Basudeb Para I North West Part of Basudeb Para,
103935,Basudeb Para,Village Panchayat,Dhalai,Ambassa,617305,2,Basudeb Para II East Part of Basudeb Para,??????? ???? II ?????  ??? ??????? ????
103935,Basudeb Para,Village Panchayat,Dhalai,Ambassa,617306,3,Basudeb Para III South West Part of Basudeb Para,??????? ???? III ??????? ????? ?????? ?????? ???
103935,Basudeb Para,Village Panchayat,Dhalai,Ambassa,617307,4,Basudeb Para IV Sudhangshu Ghosh Para Part of Sabdakar Para,??????? ???? IV ??????? ??? ???? ????? ?????  ???
103935,Basudeb Para,Village Panchayat,Dhalai,Ambassa,617308,5,Basudeb Para V Nabagram,??????? ???? V ???????
103940,East Nalicherra,Village Panchayat,Dhalai,Ambassa,107343,1,East Nalicherra I North Part of Harinmara,????? ????????? I ???????? ????? ?????
103940,East Nalicherra,Village Panchayat,Dhalai,Ambassa,617309,2,East Nalicherra II South Part of Harinmara,????? ????????? II ???????? ?????? ?????
103940,East Nalicherra,Village Panchayat,Dhalai,Ambassa,617310,3,East Nalicherra III East Part of Kulai Bazaar,????? ????????? III ????? ????? ????? ?????
103940,East Nalicherra,Village Panchayat,Dhalai,Ambassa,617311,4,East Nalicherra IV East Part of Sonaram Kobra Para and West Part of Kulai Bazaar,????? ????????? IV ?????? ??? ??????? ????? ???? ???? ??? ????? ????? ????? ?????
103940,East Nalicherra,Village Panchayat,Dhalai,Ambassa,617312,5,East Nalicherra V West Part of Sonaram Kobra Para Shashi Dutta Para and Part of Sabdakar Para,????? ????????? V ?????? ??? ??????? ????? ???? ??? ???? ????? ? ?????? ?????
103936,Kekmachera,Village Panchayat,Dhalai,Ambassa,85625,1,Kekmacherra I North Part of Ram Ratan Para,????????? I ??? ??? ????? ?????
103936,Kekmachera,Village Panchayat,Dhalai,Ambassa,617318,2,Kakmacherra II South Part of Ram Ratan Para,????????? II ??? ???  ?????? ?????
103936,Kekmachera,Village Panchayat,Dhalai,Ambassa,617319,3,Kakmacherra III North Part of Kakmacherra,????????? III ????? ????? ?????????
103936,Kekmachera,Village Panchayat,Dhalai,Ambassa,617320,4,Kakmacherra IV West Part of Kakmacherra,????????? IV ?????? ????? ?????????
103936,Kekmachera,Village Panchayat,Dhalai,Ambassa,617321,5,Kakmacherra V North Dalubari South Part of Kakmacherra,????????? V ????? ??????? ?????? ?????????
103937,Kulai,Village Panchayat,Dhalai,Ambassa,617313,1,Kulai I North Part of Thakur Palli,????? I ????? ????? ????? ?????
103937,Kulai,Village Panchayat,Dhalai,Ambassa,617314,2,Kulai II East Part of Thakur Palli,????? II ????? ????? ????? ?????
103937,Kulai,Village Panchayat,Dhalai,Ambassa,617315,3,Kulai III West Part of Thakur Palli,????? III ????? ????? ?????? ?????
103937,Kulai,Village Panchayat,Dhalai,Ambassa,617316,4,Kulai IV South Part of Thakur Palli and West Part of Netaji Nagar,????? IV ????? ????? ?????? ????? ??? ?????? ??? ?????? ?????
103937,Kulai,Village Panchayat,Dhalai,Ambassa,617317,5,Kulai V East Part of Netaji Nagar,????? V ?????? ??? ????? ?????
103941,North Nalicherra,Village Panchayat,Dhalai,Ambassa,91408,1,North Nalicherra I Lalmati Part of North West Sudharam Para and Bhumuhin Colony,????? ???????? I ????? ?????? ??????? ????? ? ??????? ????? ??????? ?????
103941,North Nalicherra,Village Panchayat,Dhalai,Ambassa,617301,2,North Nalicherra II East Part of Sudharam Para and North East Part of North Nalicherra,????? ???????? II ??????? ???????? ????? ????? ??? ????? ????? ????? ????? ????????
103941,North Nalicherra,Village Panchayat,Dhalai,Ambassa,617302,3,North Nalicherra III South East Part of Uttar Nalicherra,????? ???????? III ?????? ????? ????? ????? ????????
103941,North Nalicherra,Village Panchayat,Dhalai,Ambassa,617303,4,North Nalicherra IV North West Part of Shambhuram Para,????? ???????? IV ????? ?????? ??? ???????? ????
103941,North Nalicherra,Village Panchayat,Dhalai,Ambassa,617304,5,North Nalicherra V South East Part of Shambhuram Para,????? ???????? V ?????? ????? ??? ???????? ????
103938,West Balaram,Village Panchayat,Dhalai,Ambassa,102743,1,West Balaram I North Part of Das Para,?????? ????? I ????? ????? ??? ????
103938,West Balaram,Village Panchayat,Dhalai,Ambassa,617326,2,West Balaram II South Part of Das Para,?????? ????? II ?????? ????? ??? ????
103938,West Balaram,Village Panchayat,Dhalai,Ambassa,617327,3,West Balaram III North Part of Deb Para,?????? ????? III ????? ????? ??? ????
103938,West Balaram,Village Panchayat,Dhalai,Ambassa,617328,4,West Balaram IV South Part of Deb Para and Part of Bazaar Area,?????? ????? IV ?????? ?????  ??? ????
103938,West Balaram,Village Panchayat,Dhalai,Ambassa,617329,5,West Balaram V Part of Sashi Pal Para and Part of Bazaar Area,?????? ????? V ??? ??? ????? ??? ??? ????? ????? ???
103939,West Lalchari,Village Panchayat,Dhalai,Ambassa,91964,1,West Lalchari I North Part of Sashi Pal Para,?????? ?????? I ??? ??? ????? ????? ?????
103939,West Lalchari,Village Panchayat,Dhalai,Ambassa,617322,2,West Lalchari II South Part of Sashi Pal Para,?????? ?????? II ??? ??? ????? ?????? ?????
103939,West Lalchari,Village Panchayat,Dhalai,Ambassa,617323,3,West Lalchari III North Part of Jiten Deb Para,?????? ?????? III ????? ????? ????? ??? ????
103939,West Lalchari,Village Panchayat,Dhalai,Ambassa,617324,4,West Lalchari IV South Part of Jiten Deb Para,?????? ?????? IV ?????? ????? ????? ??? ????
103939,West Lalchari,Village Panchayat,Dhalai,Ambassa,617325,5,West Lalchari V Kartik Debbarma Para,?????? ?????? V ??????? ???????? ????
261234,Baligaon,Village Panchayat,Dhalai,Durga Chowmuhani,761586,1,Baligaon I Part of Ganganagar Revenue Mouza Baligaon North Ghosh Para Bhar Para Parsi Para School Para,??????? I ???????? ?????? ???? ????? ??? ???? ??? ??? ???? ?????  ????
261234,Baligaon,Village Panchayat,Dhalai,Durga Chowmuhani,761587,2,Baligaon II Part of Ganganagar Revenue MouzaBaligaon East Santi Para Bhairab Sarani Datta Para Bisawas Para Paul Para,??????? II ???????? ?????? ???? ????? ?????? ????  ???? ?????  ???????? ??????? ???? ??? ????
261234,Baligaon,Village Panchayat,Dhalai,Durga Chowmuhani,761588,3,Baligaon III Part of Ganganagar Revenue Mouza Middle Part of Ganganagar Dhigha Par,??????? III ???????? ?????? ???? ???????? ???? ??? ?? ???? ???
261234,Baligaon,Village Panchayat,Dhalai,Durga Chowmuhani,761589,4,Baligaon IV Part of Ganganagar Revenue Mouza West Part of Ganganagar Kabar Khala Par,??????? IV???????? ?????? ???? ?????? ????? ???????? ??? ???? ???
261234,Baligaon,Village Panchayat,Dhalai,Durga Chowmuhani,761590,5,Baligaon V Part of Ganganagar Revenue Mouza East Part of Ganganagar Ganganagar SB School Para,??????? V ???????? ?????? ???? ???????? ????? ???? ???? ????? ????
261234,Baligaon,Village Panchayat,Dhalai,Durga Chowmuhani,761591,6,Baligaon VI Part of Ganaganagar Revenue Mouza Baligaon South Fauji Para Baligaon School South Part Das Para Tin Murti Para,??????? VI ???????? ?????? ???? ?????? ???? ???? ????? ???? ??? ???? ??? ??????????
103943,Bamancherra,Village Panchayat,Dhalai,Durga Chowmuhani,89385,1,Bamancherra I Northern Part of Chulubari Revenue Mouza West Part of Nanda Kishore Para,???????? I ????? ????? ??????? ?????? ???? ?????? ????
103943,Bamancherra,Village Panchayat,Dhalai,Durga Chowmuhani,761690,2,Bamancherra II Entire Bamanchara Revenue Mouza Anil Chandra Para and East Part of Nanda Kishore Para,???????? II ???? ?????? ???? ???  ???? ????? ???? ?????
103943,Bamancherra,Village Panchayat,Dhalai,Durga Chowmuhani,761691,3,Bamancherra III Entire Bamancharra Revenue Mouza Kabidas Para Gurucharan Para and West part of Jogesh Sarkar Para,???????? III ???????? ???????? ???? ?????? ???? ??????? ???? ??? ????? ????? ???? ?????? ???
103943,Bamancherra,Village Panchayat,Dhalai,Durga Chowmuhani,761692,4,Bamancherra IV Part of Bamanchara revenue Mouza East Part of Jogesh Sarkar Para and Bhuban Deb Para,???????? IV ????? ????? ????? ???? ??? ???? ??? ???? ???????? ???? ???
103943,Bamancherra,Village Panchayat,Dhalai,Durga Chowmuhani,761693,5,Bamancherra V Entire Bamanchara Revenue Mouza Jogesh Namasudra Para and East Part of Durgadhar Para,???????? V ???????? ???????? ????
103943,Bamancherra,Village Panchayat,Dhalai,Durga Chowmuhani,761694,6,Bamancherra VI Northern Part of Chulubari Revenue Mouza Nirod Nath Para Bipul Das Para and West Part of Durgadhar Para,???????? VI ????? ????? ??????? ??????
103945,Bilashcherra,Village Panchayat,Dhalai,Durga Chowmuhani,117165,1,Bilashcherra I Entire South Bilashchara Revenue Mouza Rangicherra Kathalbari Laxmanchari and North Part of Bagaichara,????????? I ????? ?????? ????????? ?????? ???? ?????????? ????????? ??????????? ???????????? ????? ?????
103945,Bilashcherra,Village Panchayat,Dhalai,Durga Chowmuhani,761750,2,Bilashcherra II Part of North Bilashchara Revenue Mouza Bilashchara Harilal Gour Para Radhamohan Para Madhya Para SC Colony,????????? II  ?????  ????????? ?????? ????
103945,Bilashcherra,Village Panchayat,Dhalai,Durga Chowmuhani,761751,3,Bilashcherra III Part of North Bilashchara Revenue Mouza Bilashchara Muslim Colony Bhairabtali School Para Bamboothal,????????? III ?????  ????????? ?????? ????
103945,Bilashcherra,Village Panchayat,Dhalai,Durga Chowmuhani,761752,4,Bilashcherra IV Part of North Bilashchara Revenue Mouza Amtali part of Bilashchara and Benia Tilla,????????? IV ?????  ????????? ?????? ????
103945,Bilashcherra,Village Panchayat,Dhalai,Durga Chowmuhani,761753,5,Bilashcherra V Part of North Bilashchara Revenue Mouza Dhanchari Part of Bilashchara South Part of Bagaichari Baraitali Nutan Bagan and South Part of Bilashchara,????????? V ?????  ????????? ?????? ????
103947,Choto Surma,Village Panchayat,Dhalai,Durga Chowmuhani,110461,1,Chotosurma I Part of Chotosurma Revenue MouzaShibpujanahir Para North Side Rabidas Para and East Side of Shibpujanahir Para,??????????? I ??????????? ?????? ???? ??? ???????????? ????  ?????  ???? ??? ??? ????
103947,Choto Surma,Village Panchayat,Dhalai,Durga Chowmuhani,761825,2,Chotosurma II Part of Chotosurma Revenue Mouza Shibpujanahir Para East Side 20 Card Colony and North Sardargram,??????????? II ??????????? ?????? ???? ??? ???????????? ????  ????? ????  ?? ????? ?????  ???  ?????  ???????????
103947,Choto Surma,Village Panchayat,Dhalai,Durga Chowmuhani,761826,3,Chotosurma III Part of Chotosurma Revenue Mouza South Sardargram Para and Lengutia Para,??????????? III ??????????? ?????? ???? ??? ?????? ??????????? ????  ??? ?????????
103947,Choto Surma,Village Panchayat,Dhalai,Durga Chowmuhani,761827,4,Chotosurma IV Part of Chotosurma Revenue Mouza Sudhan Para Kalibari and East Part of 12 dun 12 Card,??????????? IV ??????????? ?????? ???? ???
103947,Choto Surma,Village Panchayat,Dhalai,Durga Chowmuhani,761828,5,Chotosurma V Part of Chotosurma Revenue Mouza 12 card para Part of 12 dun 12 Card West Part of 12 dun 12 Card and East Part of Noagoan 3 Number Para,??????????? V ??????????? ?????? ???? ??? 12 ????? ???? ???  ???????? 3 ?? ????
103947,Choto Surma,Village Panchayat,Dhalai,Durga Chowmuhani,761829,6,Chotosurma VI Part of Chotosurma Revenue Mouza Noagaon Para Part of Noagaon 3 no. Para West Part of Sardargram and West Part of Noagaon 3 no. Para,??????????? VI ??????????? ?????? ???? ??? ?????? ??? 3 ??  ???? ????????
103948,Chulubari,Village Panchayat,Dhalai,Durga Chowmuhani,82084,1,Chulubari I Entire Chulubari Revenue Mouza Sonadhan Das Para,???????? I ???????? ???????? ???? ???? ??? ????
103948,Chulubari,Village Panchayat,Dhalai,Durga Chowmuhani,761909,2,Chulubari II Entire Chulbri Revenue Mouza Arjun Nagbanshi Para and Gangacharan Debbarma Para,???????? II ???????? ???????? ???? ?????? ???????? ???? ??? ????????  ???????? ????
103948,Chulubari,Village Panchayat,Dhalai,Durga Chowmuhani,761910,3,Chulubari III Entire Chulubari Revenue Mouza Sabdakar Para Sushil Das Para Chintaharan Debbarma Para and Ramlaxman Para,
103948,Chulubari,Village Panchayat,Dhalai,Durga Chowmuhani,761911,4,Chulubari IV Entire Chulubari Revenue Mouza Prabhat Das Para Subal Das Para Dayan Debbarma Para and Part of Jagannath Gour Para,???????? IV ???????? ???????? ???? ?????? ??? ????  ??? ????  ???????? ????
103948,Chulubari,Village Panchayat,Dhalai,Durga Chowmuhani,761912,5,Chulubari V Entire Chulubari Revenue Mouza Pran Kumar Das Para and Sambhu Das Para,???????? V ???????? ???????? ???? ????? ????? ??? ????  ??? ??? ????
103948,Chulubari,Village Panchayat,Dhalai,Durga Chowmuhani,761913,6,Chulubari VI Entire Chulubari Revenue Mouza Bhagbath Tati Para of Rupchan Das Para,???????? VI ???????? ???????? ???? ?????? ??? ????  ????? ??? ????
103950,Debicherra,Village Panchayat,Dhalai,Durga Chowmuhani,761953,1,Debicherra I Entire Part of Debichara Revenue Mouza North Debicherra Dhawaja Tilla and North Part of Kalitilla,???????? I ???????? ???????? ????? ????? ????????  ?????? ????  ???  ????? ???????? ? ???
103950,Debicherra,Village Panchayat,Dhalai,Durga Chowmuhani,761954,2,Debicherra II Part of Debichara Revenue Mouza Kalitilla,???????? II ???????? ?????  ????????
103950,Debicherra,Village Panchayat,Dhalai,Durga Chowmuhani,761955,3,Debicherra III Entire Debichara Revenue Mouza East Debicherra and Telenga Basti,???????? III ???????? ???????? ????? ???????? ?????  ????? ????????
103950,Debicherra,Village Panchayat,Dhalai,Durga Chowmuhani,761956,4,Debicherra IV Entire Debichara Revenue Mouza Kamaranga and Kathalbari,???????? IV ???????? ???????? ?????  ????????? ??? ?????????
103950,Debicherra,Village Panchayat,Dhalai,Durga Chowmuhani,761957,5,Debicherra V East Part of South Debicherra and West Part of South Debicherra,???????? V ???????? ???????? ????? ????? ??? ?????? ???????? ???
103950,Debicherra,Village Panchayat,Dhalai,Durga Chowmuhani,761958,6,Debicherra VI Entire Debichara Revenue Mouza Debicherra Basti,???????? VI ???????? ???????? ????? ???????? ?????
103951,Duraishib Bari,Village Panchayat,Dhalai,Durga Chowmuhani,762032,1,Duraishib Bari I Non ADC Part of Duraichara Revenue Mouza Bhubancherra and Madhyadurai,???????????? I ??  ????? ????? ????????? ?????? ????? ????????  ??? ????????
103951,Duraishib Bari,Village Panchayat,Dhalai,Durga Chowmuhani,762033,2,Duraishib Bari II Part of Halahali Revenue Mouza North West Part of Halahali Shibbari,???????????? II ???????? ???? ????? ?????? ????????  ??????? ???
103951,Duraishib Bari,Village Panchayat,Dhalai,Durga Chowmuhani,762034,3,Duraishib Bari III Part of Halahali Revenue Mouza Krishnanagar,???????????? III ???????? ???? ????? ???
103951,Duraishib Bari,Village Panchayat,Dhalai,Durga Chowmuhani,762035,4,Duraishib Bari IV Non ADC Part of Duraichara Revenue Mouza East Kaimai Namasudra Para and East Part of Suklabaidya Para,???????????? IV ??  ????? ????? ????????? ?????? ????? ????? ?????? ??????? ????
103951,Duraishib Bari,Village Panchayat,Dhalai,Durga Chowmuhani,762036,5,Duraishib Bari V Non ADC Part of Revenue Mouza East Durai Mantulal Sen Para West Part of Suklabaidya Para and Singbhumij Para,???????????? V ??  ????? ????? ????????? ?????? ????? ???????? ????
103952,East Lamboochara,Village Panchayat,Dhalai,Durga Chowmuhani,762105,1,East Lamboochara I Entire Lamboochara Revenue Mouza Khas Tilla,????? ?????????? I ???????? ?????????? ???? ???????
103952,East Lamboochara,Village Panchayat,Dhalai,Durga Chowmuhani,762106,2,East Lamboochara II Entire Lamboochara Revenue Mouza Karnamoni Para,????? ?????????? II ???????? ?????????? ???? ??????? ????
103952,East Lamboochara,Village Panchayat,Dhalai,Durga Chowmuhani,762107,3,East Lamboochara III Enitre Lamboochara Revenue Mouza Barajabi Para and Makhan Sen Para,????? ?????????? III ???????? ?????????? ???? ?????? ???? ???? ??? ????
103952,East Lamboochara,Village Panchayat,Dhalai,Durga Chowmuhani,762108,4,East Lamboochara IV Entire Lamboochara Revenue Mouza Pratap Ghosh Para and Rajendra Ghosh Para,????? ?????????? IV ???????? ?????????? ???? ?????? ??? ????  ????????? ??? ????
103952,East Lamboochara,Village Panchayat,Dhalai,Durga Chowmuhani,762109,5,East Lamboochara V Entire Lamboochara Revenue Mouza Nabin Bar,????? ?????????? V ???????? ?????????? ????  ???? ????
103953,Halhali,Village Panchayat,Dhalai,Durga Chowmuhani,88096,1,Halhali I Part of Halhali Revenue Mouza East Side of West Halahali Part,???????? I ???????? ???? ????? ?????? ???????? ????? ????
103953,Halhali,Village Panchayat,Dhalai,Durga Chowmuhani,762271,2,Halhali II Part of Halahali Revenue Mouza Part of West Halahali School Para,???????? II ???????? ???? ????? ?????? ???????? ????? ????
103953,Halhali,Village Panchayat,Dhalai,Durga Chowmuhani,762272,3,Halhali III Part of Halahali Revenue Mouza Halahali,???????? III ???????? ???? ????? ????????
103953,Halhali,Village Panchayat,Dhalai,Durga Chowmuhani,762273,4,Halhali IV Part of Halahali Revenue Mouza East of Halahali,???????? IV ???????? ???? ????? ????????  ????? ????
103953,Halhali,Village Panchayat,Dhalai,Durga Chowmuhani,762274,5,Halhali V Part of Halahali Revenue Mouza South Halahal,???????? V ???????? ???? ????? ???????? ?????? ????
103953,Halhali,Village Panchayat,Dhalai,Durga Chowmuhani,762275,6,Halhali VI Part of Nakful Revenue Mouza East Nakful,???????? VI ?????? ???? ????? ??????
103953,Halhali,Village Panchayat,Dhalai,Durga Chowmuhani,762276,7,Halhali VII Part of Nakful Revenue Mouza West Nakful,???????? VII ?????? ???? ????? ??????
103954,Halhuli,Village Panchayat,Dhalai,Durga Chowmuhani,103520,1,Halhuli I Part of Panchasi Revenue Mouza Halhuli and Singibil,
103954,Halhuli,Village Panchayat,Dhalai,Durga Chowmuhani,762581,2,Halhuli II Part of Halhuli Revenue Mouza Chandan Nagar and Barasurma,??????? II ??????? ???? ??? ???????? ????????
103954,Halhuli,Village Panchayat,Dhalai,Durga Chowmuhani,762582,3,Halhuli III Part of Halhuli Revenue Mouza North Part of Lalchari and Tehshil Para of Barasurma,??????? III ??????? ???? ??? ????? ?????? ?????? ????  ????????
103954,Halhuli,Village Panchayat,Dhalai,Durga Chowmuhani,762583,4,Halhuli IV Part of Halhuli Revenue Mouza South Part of Lalchari,??????? IV??????? ???? ??? ?????? ??????? ???
103954,Halhuli,Village Panchayat,Dhalai,Durga Chowmuhani,762584,5,Halhuli V Part of Panchasi Revenue Mouza East Part of Panchasi,??????? V ?????? ???? ??? ????? ?????? ???
103954,Halhuli,Village Panchayat,Dhalai,Durga Chowmuhani,762585,6,Halhuli VI Part of Phanchasi Revenue Mouza West Part of Panchasi and North Part of Panchasi,??????? VI ?????? ???? ??? ????? ? ?????? ?????? ???
103955,Harerkhola,Village Panchayat,Dhalai,Durga Chowmuhani,762712,1,Harerkhola I The Entire Harerkhola Revenue Mouza West Part of Tangla Para,??????? I ???????? ??????? ???? ?????? ???? ?????? ???
103955,Harerkhola,Village Panchayat,Dhalai,Durga Chowmuhani,762713,2,Harerkhola II The Entire Harerkhola revenue Mouza Homeless Para,??????? II ???????? ??????? ???? ????? ????
103955,Harerkhola,Village Panchayat,Dhalai,Durga Chowmuhani,762714,3,Harerkhola III The Entire Harerkhola Revenue Mouza Dhalai River Band Para,??????? III ???????? ??????? ???? ???? ????
103955,Harerkhola,Village Panchayat,Dhalai,Durga Chowmuhani,762715,4,Harerkhola IV The Entire Harekhola Revenue Mouza Rickshaw Puller Para,??????? IV ???????? ??????? ???? ??????? ??????? ????
103955,Harerkhola,Village Panchayat,Dhalai,Durga Chowmuhani,762716,5,Harerkhola V The Entire Harerkhola Revenue Mouza Baidyakar Para,??????? V ???????? ??????? ???? ???????? ????
103956,Kalachari,Village Panchayat,Dhalai,Durga Chowmuhani,762827,1,Kalachari I Part of Kalachari Revenue Mouza Kunda Para Part of Kalachari 3 and Kunda Para Part of Kalachari 3 Rasikdas Para,?????? I ?????? ???? ??? ?????? ???? 3 ??????? ????
103956,Kalachari,Village Panchayat,Dhalai,Durga Chowmuhani,762828,2,Kalachari II Part of Kalachari Revenue Mouza Jyotish Ghosh Para Part of Kalachari 1 and Jyotish Ghosh Para Part of Kalachari 1 Suklabaidhya Para,?????? II ?????? ???? ??? ??????? ??? ????  ??????????? ????
103956,Kalachari,Village Panchayat,Dhalai,Durga Chowmuhani,762829,3,Kalachari III Part of Kalachari Revenue Mouza Athghar Part of Kalachari 1 and Athghar Part of Kalachari 1 Badyakar Para,?????? III ?????? ???? ??? ???? ???? ???????? ????
103956,Kalachari,Village Panchayat,Dhalai,Durga Chowmuhani,762830,4,Kalachari IV Part of Kalachari Revenue mouza Dhalai Par Part of Kalachari 1 1 No. Kalachari Colony and Dhalai Par Dhalai Bank Para,?????? IV ?????? ???? ???  ???? ??????
103956,Kalachari,Village Panchayat,Dhalai,Durga Chowmuhani,762831,5,Kalachari V Part of Kalachari Revenue Mouza Madhya Para,??????? V ??????? ????? ???? ???? ????
103957,Kuchainala,Village Panchayat,Dhalai,Durga Chowmuhani,762897,1,Kuchainala I Part of Kuchainala Revenue Mouza Kuchainala,???????? I ???????? ???? ????? ????????
103957,Kuchainala,Village Panchayat,Dhalai,Durga Chowmuhani,762898,2,Kuchainala II Part of Kuchainala Revenue Mouza North Kuchainala,???????? II ???????? ???? ????? ????? ????????
103957,Kuchainala,Village Panchayat,Dhalai,Durga Chowmuhani,762899,3,Kuchainala III Part of Kuchainala Revenue Mouza East Kuchainala,???????? III ???????? ???? ????? ????? ????????
103957,Kuchainala,Village Panchayat,Dhalai,Durga Chowmuhani,762900,4,Kuchainala IV Part of Kuchainala Revenue Mouza South Kuchainala,???????? IV ???????? ???? ????? ?????? ????????
103957,Kuchainala,Village Panchayat,Dhalai,Durga Chowmuhani,762901,5,Kuchainala V Part of Kuchainala Revenue MouzaNagbanshi,???????? V ???????? ???? ????? ???????
103958,Mahabir,Village Panchayat,Dhalai,Durga Chowmuhani,762998,1,Mahabir I Part of Mahabr Revenue Moza West Para of East West Tilula,?????? I ?????? ???? ????? ?????? ???? ?? ????? ?????? ????????
103958,Mahabir,Village Panchayat,Dhalai,Durga Chowmuhani,762999,2,Mahabir II Part of Mahabir Revenue MouzaEast and West Para of East West Tilla,?????? II ?????? ???? ?????  ?????? ???? ?? ????? ?????? ????
103958,Mahabir,Village Panchayat,Dhalai,Durga Chowmuhani,763000,3,Mahabir III Part of Mahabir Revenue Mouza East and Gour Para of East West Tilla,?????? III ?????? ???? ????? ??? ???? ????? ?????? ????
103958,Mahabir,Village Panchayat,Dhalai,Durga Chowmuhani,763001,4,Mahabir IV The Entire Mahabir Revenue Mouza Natun Bagan,?????? IV ???????? ?????? ???? ????? ???? ?????
103958,Mahabir,Village Panchayat,Dhalai,Durga Chowmuhani,763002,5,Mahabir V The Entire Mahabir Revenue Mouza Mahabir Basti Madhanpur and Rupchan Debbarma Para,?????? V ???????? ?????? ???? ????? ?????? ?????  ???????? ???  ????? ???????? ????
103959,Manikbhandar,Village Panchayat,Dhalai,Durga Chowmuhani,105756,1,Manikbhander I Part of Manikbhander Revenue Mouza Manikbhander and Manikbhander Bazar of Bazar Para,???????????? I ???????????? ???? ??? ???????????? ?? ????? ????
103959,Manikbhandar,Village Panchayat,Dhalai,Durga Chowmuhani,763194,2,Manikbhandar II Part of Manikbhander Revenue Mouza Kandigram Kandigram North Part of Kandigram Bazarpara Kandigram North Part of Manikbhander,???????????? II ???????????? ???? ???  ????? ??????????? ?? ??? ????? ????
103959,Manikbhandar,Village Panchayat,Dhalai,Durga Chowmuhani,763195,3,Manikbhandar III Part of Manikbhander Revenue Mouza Bhubancherra Hira Datta Para Maina Debbarma Para Nirod Deb Para and Harendra Deb Para,???????????? III ???????????? ???? ??? ???? ???? ????  ???? ???????? ????  ???? ??? ????  ???????? ??? ????
103959,Manikbhandar,Village Panchayat,Dhalai,Durga Chowmuhani,763196,4,Manikbhandar IV Part of Manikbhander Revenue Mouza Kandigram South Part of Kandigram Bishnu Debbarma Para and West Manikbhandar Maina Debbarma Para Hira Datta Para Datta Para,???????????? IV ???????????? ???? ??? ?????? ??????????? ?????? ???????? ????  ?????? ????????????  ??? ???????? ????
103959,Manikbhandar,Village Panchayat,Dhalai,Durga Chowmuhani,763197,5,Manikbhandar V Part of Manikbhander Revenue Mouza Bazar Para Datta Para Sadhu Bari Tehshil Para and Manikbhandar North Part of Manikbhandar,???????????? V ???????????? ???? ??? ????? ???? ???? ????  ?????? ????  ??? ????? ???????????? ???
103960,Maracherra,Village Panchayat,Dhalai,Durga Chowmuhani,112688,1,Maracherra I The Entire Maracherra Revenue Mouza North Maracherra and West Part of East Sonarai,??? ???? I ???????? ??? ????  ???? ????
103960,Maracherra,Village Panchayat,Dhalai,Durga Chowmuhani,763422,2,Maracherra II The Entire Maracherra Revenue Mouza East Sonarai and North Part of South Sonarai,??? ???? II ???????? ??? ????  ???? ????
103960,Maracherra,Village Panchayat,Dhalai,Durga Chowmuhani,763423,3,Maracherra III The Entire Maracherra Revenue Mouza South Sonarai and North Part of Kartikgram,??? ???? III ???????? ??? ????  ???? ????
103960,Maracherra,Village Panchayat,Dhalai,Durga Chowmuhani,763424,4,Maracherra IV The Entire Maracherra Revenue Mouza Kartikgram,??? ???? IV ???????? ??? ????  ???? ????
103960,Maracherra,Village Panchayat,Dhalai,Durga Chowmuhani,763425,5,Maracherra V The Entire Maracherra Revenue MouzaNorth West Part of Kartikgram and Maracherra Bazar,??? ???? V ???????? ??? ????  ???? ????
103960,Maracherra,Village Panchayat,Dhalai,Durga Chowmuhani,763426,6,Maracherra VI The Entire Maracherra Revenue Mouza North Part of Maracherra Bazar and South Part of East Sonarai,??? ???? VI ???????? ??? ????  ???? ????
103961,Mayachari,Village Panchayat,Dhalai,Durga Chowmuhani,763513,1,Mayachari I The Entire Mayachari Revenue Mouja 10 No. Basti and 10 No. Para,??????? I ???????? ???????  ???? 10 ?? ???? ??? 10 ?? ?????
103961,Mayachari,Village Panchayat,Dhalai,Durga Chowmuhani,763515,2,Mayachari II The Entire Mayachari Revenue Mouja Homeless Colony and North East Part of Ramdurlavpur,??????? II ???????? ???????  ???? ??????? ????? ??? ????? ?????  ????????? ????
103961,Mayachari,Village Panchayat,Dhalai,Durga Chowmuhani,763517,3,Mayachari III The Entire Maychari revenue Mouja Barkanta Para and Khastilla,??????? III ???????? ???????  ???? ???????? ??? ???????
