Local Body Code,Local Body Name,Local Body Type,"District Level
Parent Name
","Intermediate Level
Parent Name",Ward Code,"Ward
Number","Ward Name
(In English)
","Ward Name
(In Local)
"
104434,Jagannathbari,Village Panchayat,Khowai,Teliamura,768729,3,Jagannathbari III Trishabari East and South side of TK Road,??????????? III
104434,Jagannathbari,Village Panchayat,Khowai,Teliamura,768730,4,Jagannathbari IV Trishabari Part of East side of TK Road,??????????? IV
104434,Jagannathbari,Village Panchayat,Khowai,Teliamura,768731,5,Jagannathbari V Icharbil Part of East and West Side of TK Road,??????????? V
104434,Jagannathbari,Village Panchayat,Khowai,Teliamura,768732,6,Jagannathbari VI Icharbil Part of West Side of TK Road,??????????? VI
104434,Jagannathbari,Village Panchayat,Khowai,Teliamura,768733,7,Jagannathbari VII Icharbil Part of West Side of TK Road,??????????? VII
104435,Khashia Mangal,Village Panchayat,Khowai,Teliamura,119307,1,Khashia Mangal I Dayaram Para and Pran Krishna Para,?????? ????? I
104435,Khashia Mangal,Village Panchayat,Khowai,Teliamura,768775,2,Khashia Mangal II South Part of Mangal Sardar Para,?????? ????? II
104435,Khashia Mangal,Village Panchayat,Khowai,Teliamura,768776,3,Khashia Mangal III North Part of Mangal Sardar Para and Mali Chowkider Para,?????? ????? III
104435,Khashia Mangal,Village Panchayat,Khowai,Teliamura,768777,4,Khashia Mangal IV North Part of Harish Ch. Para Kashinath Para Rajmohan Para and Haricharan Para,?????? ????? IV
104435,Khashia Mangal,Village Panchayat,Khowai,Teliamura,768778,5,Khashia Mangal V Malsom Para,?????? ????? V
104436,Laxmipur,Village Panchayat,Khowai,Teliamura,110943,1,Laxmipur-I Harilal Chowdhury Para Baraj Katha Para Mantu Roy Para Anil Das Para B.Debbarma Para Tapan Das Para A Ghosh and Arun Bh.,?????????? I
104436,Laxmipur,Village Panchayat,Khowai,Teliamura,768820,2,Laxmipur II Master Para Jatin Das Para Amulya Ghosh Para Chitta Das Para Promode Debnath Para and Indra Majumder Para,?????????? II
104436,Laxmipur,Village Panchayat,Khowai,Teliamura,768821,3,Laxmipur III Narayan Das Para and Baeman Para,?????????? III
104436,Laxmipur,Village Panchayat,Khowai,Teliamura,768822,4,Laxmipur IV Saraswati Para Kalidas Saha Para Gopal Das Para Shyamaprasad Para Nepal Roy Para and Abani Das Para,?????????? IV
104436,Laxmipur,Village Panchayat,Khowai,Teliamura,768823,5,Laxmipur V Nepal Debbarma Para Himesh Roy Para Laxmi Kanta Sr. Para Girendra Ch. Para Nil Kanta Sarkar Para and Sunil Debnath Para,?????????? V
104436,Laxmipur,Village Panchayat,Khowai,Teliamura,768824,6,Laxmipur VI Brejendra Majumder Para South Chakraborty Para Harendra Sarkar Para Mahanta Sarkar Para and D.M.Colony,?????????? VI
104436,Laxmipur,Village Panchayat,Khowai,Teliamura,768825,7,Laxmipur VII Ashok Gupta Para Nripendra Dey Para and Dulal Majumder Para,?????????? VII
104437,Madhya Krishnapur,Village Panchayat,Khowai,Teliamura,103865,1,Madhya Krishnapur I MT Para South Part,???? ???????? I
104437,Madhya Krishnapur,Village Panchayat,Khowai,Teliamura,768861,2,Madhya Krishnapur II Balucherra North Para and Deb Para,???? ???????? II
104437,Madhya Krishnapur,Village Panchayat,Khowai,Teliamura,768862,3,Madhya Krishnapur III East and West Para of Balucherra,???? ???????? III
104437,Madhya Krishnapur,Village Panchayat,Khowai,Teliamura,768863,4,Madhya Krishnapur IV Office Tilla and Balucherra South Part,???? ???????? IV
104437,Madhya Krishnapur,Village Panchayat,Khowai,Teliamura,768864,5,Madhya Krishnapur V Pukui Bari and Champlai South Part,???? ???????? V
104437,Madhya Krishnapur,Village Panchayat,Khowai,Teliamura,768865,6,Madhya Krishnapur VI Champlai North Part,???? ???????? VI
104438,Maiganga,Village Panchayat,Khowai,Teliamura,89857,1,Maiganga I Nayabari and West Maiganga,???????? I
104438,Maiganga,Village Panchayat,Khowai,Teliamura,768907,2,Maiganga II Melarpathar and Kalangshimura,???????? II
104438,Maiganga,Village Panchayat,Khowai,Teliamura,768908,3,Maiganga III Maiganga North Part,???????? III
104438,Maiganga,Village Panchayat,Khowai,Teliamura,768909,4,Maiganga IV Maiganga Middle Part,???????? IV
104438,Maiganga,Village Panchayat,Khowai,Teliamura,768910,5,Maiganga V Maiganaga South Part,???????? V
104438,Maiganga,Village Panchayat,Khowai,Teliamura,768911,6,Maiganga VI Maiganga East Part and D.M.Colony North Part,???????? VI
104439,Moharcherra,Village Panchayat,Khowai,Teliamura,106557,1,Moharcherra I Debendra Sarder Para and Ghosh Para,???????? I
104439,Moharcherra,Village Panchayat,Khowai,Teliamura,768973,2,Moharcherra II North Para,???????? II
104439,Moharcherra,Village Panchayat,Khowai,Teliamura,768974,3,Moharcherra III Mohananda Mal Para and Part of Das Para,???????? III
104439,Moharcherra,Village Panchayat,Khowai,Teliamura,768975,4,Moharcherra IV 12 Card and South Part of Radhacharan Tilla,???????? IV
104439,Moharcherra,Village Panchayat,Khowai,Teliamura,768976,5,Moharcherra V Radhacharan Tilla and Laltilla,???????? V
104439,Moharcherra,Village Panchayat,Khowai,Teliamura,768977,6,Moharcherra VI Part of Das Para,???????? VI
104444,North Krishnapur,Village Panchayat,Khowai,Teliamura,85705,1,North Krishnapur I East Part of Krishnapur Colony,????? ???????? I
104444,North Krishnapur,Village Panchayat,Khowai,Teliamura,768993,2,North Krishnapur II Jumia Colony,????? ???????? II
104444,North Krishnapur,Village Panchayat,Khowai,Teliamura,768994,3,North Krishnapur III Krishnapur Colony West Part,????? ???????? III
104444,North Krishnapur,Village Panchayat,Khowai,Teliamura,768995,4,North Krishnapur IV Sonatan Das Baisnab Para,????? ???????? IV
104444,North Krishnapur,Village Panchayat,Khowai,Teliamura,768996,5,North Krishnapur V Ram Babu Para and Nayanpur North Part,????? ???????? V
104444,North Krishnapur,Village Panchayat,Khowai,Teliamura,768997,6,North Krishnapur VI Nayanpur South Part,????? ???????? VI
104442,Rupa Cherra,Village Panchayat,Khowai,Teliamura,91529,1,Rupa Cherra I Bharat Sardar Para,???? ???? I
104442,Rupa Cherra,Village Panchayat,Khowai,Teliamura,769030,2,Rupa Cherra II Sarat Kalai Para,???? ???? II
104442,Rupa Cherra,Village Panchayat,Khowai,Teliamura,769031,3,Rupa Cherra III Purna Ch. Karbong Para,???? ???? III
104442,Rupa Cherra,Village Panchayat,Khowai,Teliamura,769032,4,Rupa Cherra IV Harendra Sardar Para,???? ???? IV
104442,Rupa Cherra,Village Panchayat,Khowai,Teliamura,769033,5,Rupa Cherra V Manipuri Colony,???? ???? V
104431,South Krishnapur,Village Panchayat,Khowai,Teliamura,113519,1,South Krishnapur I Golabari North Part,?????? ???????? I
104431,South Krishnapur,Village Panchayat,Khowai,Teliamura,769062,2,South Krishnapur II D.M.Colony Part,?????? ???????? II
104431,South Krishnapur,Village Panchayat,Khowai,Teliamura,769063,3,South Krishnapur III D.M.Colony Part,?????? ???????? III
104431,South Krishnapur,Village Panchayat,Khowai,Teliamura,769064,4,South Krishnapur IV Golabari South Part,?????? ???????? IV
104431,South Krishnapur,Village Panchayat,Khowai,Teliamura,769065,5,South Krishnapur V Golabari Middle Part,?????? ???????? V
104431,South Krishnapur,Village Panchayat,Khowai,Teliamura,769066,6,South Krishnapur VI Baishgaria South Part,?????? ???????? VI
104431,South Krishnapur,Village Panchayat,Khowai,Teliamura,769067,7,South Krishnapur VII Baishgaria North Part,?????? ???????? VII
104443,Tuichindrai,Village Panchayat,Khowai,Teliamura,106393,1,Tuichindrai I 14 Card of Darjilingmura,???????????? I
104443,Tuichindrai,Village Panchayat,Khowai,Teliamura,769103,2,Tuichindrai II Dhanchakma and Ghaniarbill,???????????? II
104443,Tuichindrai,Village Panchayat,Khowai,Teliamura,769104,3,Tuichindrai III Pulinpur Colony Rickshaw Sibir,???????????? III
104443,Tuichindrai,Village Panchayat,Khowai,Teliamura,769105,4,Tuichindrai IV Tuichindrai,???????????? IV
104443,Tuichindrai,Village Panchayat,Khowai,Teliamura,769106,5,Tuichindrai V Tuichindrai Colony,???????????? V
104443,Tuichindrai,Village Panchayat,Khowai,Teliamura,769107,6,Tuichindrai VI Baralunga and West Part of Tuichindrai Colony,???????????? VI
261244,Vivekananda Nagar,Village Panchayat,Khowai,Teliamura,769176,1,Vivekananda Nagar I South Part of Kuishartilla,?????????? ??? I
261244,Vivekananda Nagar,Village Panchayat,Khowai,Teliamura,769177,2,Vivekananda Nagar II West Part of Kusaitilla,?????????? ??? II
261244,Vivekananda Nagar,Village Panchayat,Khowai,Teliamura,769178,3,Vivekananda Nagar III North Part of Kusaitilla,?????????? ??? III
261244,Vivekananda Nagar,Village Panchayat,Khowai,Teliamura,769179,4,Vivekananda Nagar IV South Portion of Karailong Shil Para Part,?????????? ??? IV
261244,Vivekananda Nagar,Village Panchayat,Khowai,Teliamura,769180,5,Vivekananda Nagar V South Portion of Karailong Shil Para Part,?????????? ??? V
261244,Vivekananda Nagar,Village Panchayat,Khowai,Teliamura,769181,6,Vivekananda Nagar VI Western part of Karailong Tilla,?????????? ??? VI
104440,West Howaibari,Village Panchayat,Khowai,Teliamura,95865,1,West Howaibari I Thangnai Bazar,?????? ?????????? I
104440,West Howaibari,Village Panchayat,Khowai,Teliamura,769214,2,West Howaibari II Mandal Para,?????? ?????????? II
104440,West Howaibari,Village Panchayat,Khowai,Teliamura,769216,3,West Howaibari III Haricharan Para,?????? ?????????? III
104440,West Howaibari,Village Panchayat,Khowai,Teliamura,769218,4,West Howaibari IV Bengali Para,?????? ?????????? IV
104440,West Howaibari,Village Panchayat,Khowai,Teliamura,769219,5,West Howaibari V Paul Para,?????? ?????????? V
104441,West Teliamura,Village Panchayat,Khowai,Teliamura,118066,1,West Teliamura I East and West Part of Karkari,?????? ?????????? I
104441,West Teliamura,Village Panchayat,Khowai,Teliamura,769231,2,West Teliamura II Nabin Kalai Para,?????? ?????????? II
104441,West Teliamura,Village Panchayat,Khowai,Teliamura,769232,3,West Teliamura III West Part of Karailong Tilla excluding Portion of Vivekananda Nagar GP Pulinpur South,?????? ?????????? III
104441,West Teliamura,Village Panchayat,Khowai,Teliamura,769233,4,West Teliamura IV Kuishertilla excluding Vivekananda NAgar GP Pulinpur East,?????? ?????????? IV
104441,West Teliamura,Village Panchayat,Khowai,Teliamura,769234,5,West Teliamura V South Portion of Karailong Shil Para excluding Vivekanada Nagar GP Pulinpur North,?????? ?????????? V
104046,Bagbasa,Village Panchayat,North Tripura,Jubarajnagar,94098,1,Bagabasa I Chanda Para,??????? I  ????? ????
104046,Bagbasa,Village Panchayat,North Tripura,Jubarajnagar,761676,2,Bagabasa II Colony Para,??????? I I ????? ????
104046,Bagbasa,Village Panchayat,North Tripura,Jubarajnagar,761677,3,Bagabasa III Madhya Para,??????? I II ???? ????
104046,Bagbasa,Village Panchayat,North Tripura,Jubarajnagar,761678,4,Bagabasa IV West Para,??????? I V ???? ????
104046,Bagbasa,Village Panchayat,North Tripura,Jubarajnagar,761679,5,Bagabasa V Hindustani Para,???????  V ???????????? ????
261223,Charupasa,Village Panchayat,North Tripura,Jubarajnagar,763406,1,Charupasa I Charupasa West Para of Charupasa,????????  I ???????? ?? ?? ?????? ???? ????
261223,Charupasa,Village Panchayat,North Tripura,Jubarajnagar,763408,2,Charupasa II Charupasa East Colony Charupasa Madhya Colony of Charupasa,???????? II ???? ???? ????? ????? ???????? ?? ???????? ???? ?????
261223,Charupasa,Village Panchayat,North Tripura,Jubarajnagar,763410,3,Charupasa III Uptakhali Colony,???????? III ????????? ?????
261223,Charupasa,Village Panchayat,North Tripura,Jubarajnagar,763412,4,Charupasa IV Charupasa East Para of Charupasa,???????? IV ???? ???? ?? ???????? ????? ????
261223,Charupasa,Village Panchayat,North Tripura,Jubarajnagar,763414,5,Charupasa V Charupasa South Para of Charupasa,???????? V ???????? ?? ???????? ?????? ????
104050,Dewanpasa,Village Panchayat,North Tripura,Jubarajnagar,89528,1,Dewanpasa I Datta Tilla of Radio Centre Area and East Dewanpasa East Part of Sabdakar Para,?????????? I ????? ??????? ?? ???? ???? ??? ????? ?????????? ?? ????? ???
104050,Dewanpasa,Village Panchayat,North Tripura,Jubarajnagar,761754,2,Dewanpasa II Manipuri Basti and Blind and handicapped para Gram Panchayat Office Area of Garjan Tilla,?????????? II ??????? ????? ???????? ??? ?????????? ???? ????? ???? ?? ????? ????????? ????
104050,Dewanpasa,Village Panchayat,North Tripura,Jubarajnagar,761755,3,Dewanpasa III Nath Para Lamba Tilla Madhya East Dewanpasa of North Part of Gareri Tilla and South East Dewanpasa of Rabidas Para,?????????? III ??? ???? ????? ???? ???? ????? ???????????? ??????  ???? ?? ????? ??? ??? ?????? ???? ?? ?????? ????? ???
104050,Dewanpasa,Village Panchayat,North Tripura,Jubarajnagar,761756,4,Dewanpasa IV Hrishidas Para Madhya Dewanpasa of Bhumihin Colony and Sub Centre Para VCL Para of South Part of Gareri Tilla,?????????? IV ?????? ???? ??????? ????? ?? ???? ??????????
104050,Dewanpasa,Village Panchayat,North Tripura,Jubarajnagar,761757,5,Dewanpasa V West Part of Bhunatilla Telipara and South Dewanpasa J.B.School Para of Santipara,?????????? V ???????? ???????? ??? ?????? ?????????? ?? ?? ????? ????
104050,Dewanpasa,Village Panchayat,North Tripura,Jubarajnagar,761758,6,Dewanpasa VI Manipuri Mandap Para of Bhunatilla East Part,?????????? VI ???????? ?????  ??? ?? ??????? ????? ????
104051,Dhupirbond,Village Panchayat,North Tripura,Jubarajnagar,105565,1,Dhupirband I North Krishnapur,?????????? I ????? ????????
104051,Dhupirbond,Village Panchayat,North Tripura,Jubarajnagar,761903,2,Dupirband II South Krishnapur and Madhya Krishnapur,?????????? II ?????? ???????? ??? ???? ????????
104051,Dhupirbond,Village Panchayat,North Tripura,Jubarajnagar,761904,3,Dupirband III East Krishnapur,?????????? III ????? ????????
104051,Dhupirbond,Village Panchayat,North Tripura,Jubarajnagar,761905,4,Dupirband IV North Dupirband and West Part of South East Dupirband,?????????? IV ????? ?????????? ?????? ????? ?????????? ?? ?????? ???
104051,Dhupirbond,Village Panchayat,North Tripura,Jubarajnagar,761906,5,Dupirband V Madhya Dupirband,?????????? V ???? ??????????
104051,Dhupirbond,Village Panchayat,North Tripura,Jubarajnagar,761907,6,Dupirband VI North East Side of Madhya Dupirband,?????????? VI ???? ?????????? ?? ????? ????? ???
104051,Dhupirbond,Village Panchayat,North Tripura,Jubarajnagar,761908,7,Dupirband VII East Part of South East Dupirband and South West Dupirband,?????????? VII ?????? ????? ?????????? ?? ????? ??? ??? ?????? ??????  ??????????
104061,East Tilthai,Village Panchayat,North Tripura,Jubarajnagar,103237,1,East Tilthai I Noagaon,????? ????? I ???????
104061,East Tilthai,Village Panchayat,North Tripura,Jubarajnagar,763484,2,East Tilthai II Tilthaibazar,????? ????? II ????? ?????
104061,East Tilthai,Village Panchayat,North Tripura,Jubarajnagar,763485,3,East Tilthai III Choudhury Bari of South Tilthai,????? ????? III ?????? ????? ?? ?????? ????
104061,East Tilthai,Village Panchayat,North Tripura,Jubarajnagar,763486,4,East Tilthai IV Satdrone,????? ????? IV ????????
104061,East Tilthai,Village Panchayat,North Tripura,Jubarajnagar,763487,5,East Tilthai V Betangi,????? ????? V ????????
104061,East Tilthai,Village Panchayat,North Tripura,Jubarajnagar,763488,6,East Tilthai VI Betangi of Bhumihin Colony,????? ????? VI ??????? ????? ?? ????????
104052,Huplong,Village Panchayat,North Tripura,Jubarajnagar,112864,1,Huplong I Huplong Bara Line,????? I ????? ?? ????
104052,Huplong,Village Panchayat,North Tripura,Jubarajnagar,761914,2,Huplong II Bazar Tilla,????? II ????? ????
104052,Huplong,Village Panchayat,North Tripura,Jubarajnagar,761915,3,Huplong III North of East Huplong,????? III ????? ????? ?? ????? ???
104052,Huplong,Village Panchayat,North Tripura,Jubarajnagar,761916,4,Huplong IV South of East Huplong,????? IV ????? ????? ?? ?????? ???
104052,Huplong,Village Panchayat,North Tripura,Jubarajnagar,761917,5,Huplong V East Kalikapur,????? V ????? ?????????
104052,Huplong,Village Panchayat,North Tripura,Jubarajnagar,761918,6,Huplong VI West Kalikapur,????? VI ?????? ?????????
104052,Huplong,Village Panchayat,North Tripura,Jubarajnagar,761919,7,Huplong VII West Huplong,????? VII ?????? ?????
104054,Jubarajnagar,Village Panchayat,North Tripura,Jubarajnagar,80040,1,Jubarajnagar I Jubarajnagar west,????????? I ?????? ?????????
104054,Jubarajnagar,Village Panchayat,North Tripura,Jubarajnagar,761959,2,Jubarajnagar II West of Madhya Jubarajnagar,????????? II ???? ????????? ?? ?????? ???
104054,Jubarajnagar,Village Panchayat,North Tripura,Jubarajnagar,761960,3,Jubarajnagar III East of Madhya Jubarajnagar,????????? III ???? ????????? ?? ????? ???
104054,Jubarajnagar,Village Panchayat,North Tripura,Jubarajnagar,761961,4,Jubarajnagar IV Part of Mangakhali S.C.Para of South S.C.Para,????????? IV ?????? ?? ?? ???? ?? ?????????? ?? ?? ????
104054,Jubarajnagar,Village Panchayat,North Tripura,Jubarajnagar,761962,5,Jubarajnagar V South East Jubarajnagar,????????? V ?????? ????? ?????????
104054,Jubarajnagar,Village Panchayat,North Tripura,Jubarajnagar,761963,6,Jubarajnagar VI Part of Jubarajnagar of South Jubarajnagar,????????? VI  ????????? ??  ?????? ????????? ???
104055,Kameswar,Village Panchayat,North Tripura,Jubarajnagar,120492,1,Kameshwar I Signal Basti of West Kameswar North,???????? I ?????? ???????? ????? ?? ??????? ?????
104055,Kameswar,Village Panchayat,North Tripura,Jubarajnagar,762054,2,Kameswar II Madhya Kameswar,???????? II ???? ????????
104055,Kameswar,Village Panchayat,North Tripura,Jubarajnagar,762055,3,Kameswar III Madhya Kameswar of Sanjay Colony,???????? III ???? ???????? ?? ?????? ?????
104055,Kameswar,Village Panchayat,North Tripura,Jubarajnagar,762056,4,Kameswar IV East of Sanjay Colony,???????? IV ?????? ????? ?? ?????
104055,Kameswar,Village Panchayat,North Tripura,Jubarajnagar,762057,5,Kameswar V Natunpalli Mission Tilla Natun Bazar of East Kameswar,???????? V ????? ???????? ?? ????????? ???? ???? ??? ???? ?????
104055,Kameswar,Village Panchayat,North Tripura,Jubarajnagar,762058,6,Kameswar VI Mission Tilla of East Kameswar,???????? VI ????? ???????? ?? ???? ????
104055,Kameswar,Village Panchayat,North Tripura,Jubarajnagar,762059,7,Kameswar VII Bhattacherjee Para Pal para of West Kameswar South,???????? VII ?????? ???????? ?????? ?? ??????????? ???? ??? ??? ????
104056,Lalcherra,Village Panchayat,North Tripura,Jubarajnagar,119107,1,Lalcherra I North Part of Latugaon,?????? I ??????? ?? ????? ???
104056,Lalcherra,Village Panchayat,North Tripura,Jubarajnagar,762075,2,Lalcherra II North Para,?????? II ????? ????
104056,Lalcherra,Village Panchayat,North Tripura,Jubarajnagar,762076,3,Lalcherra III Madhya Para,?????? III ???? ????
104056,Lalcherra,Village Panchayat,North Tripura,Jubarajnagar,762077,4,Lalcherra IV South Para of Lalcherra East para,?????? IV ?????? ????? ???? ?? ?????? ????
104056,Lalcherra,Village Panchayat,North Tripura,Jubarajnagar,762078,5,Lalcherra V Lalcherra West Para,?????? V ?????? ?????? ????
104056,Lalcherra,Village Panchayat,North Tripura,Jubarajnagar,762079,6,Lalcherra VI Latugaon South,?????? VI ??????? ??????
261222,Mangalkhali,Village Panchayat,North Tripura,Jubarajnagar,761990,1,Mangalkhali I Pal Para,????????? I ??? ????
261222,Mangalkhali,Village Panchayat,North Tripura,Jubarajnagar,761991,2,Mangalkhali II North Mangalkhali and Madhya Mangalkhali,????????? II ????? ????????? ??? ???? ?????????
261222,Mangalkhali,Village Panchayat,North Tripura,Jubarajnagar,761992,3,Mangalkhali III Part of Mangalkhali S.C Para of East S.C Para,????????? III ????????? ?? ?? ???? ?? ??? ????? ?? ?? ????
261222,Mangalkhali,Village Panchayat,North Tripura,Jubarajnagar,761993,4,Mangalkhali IV South Mangalkhali and North East Jubarajnagar,????????? IV ?????? ????????? ??? ????? ????? ?????? ???
261222,Mangalkhali,Village Panchayat,North Tripura,Jubarajnagar,761994,5,Mangalkhali V Part of Jubarajnagar of North Madhya Jubarajnagar,????????? V ????? ???? ????????? ?? ????????? ???
104057,North Ganganagar,Village Panchayat,North Tripura,Jubarajnagar,85040,1,North Ganganagar I North West Para,????? ???????? I ????? ?????? ????
104057,North Ganganagar,Village Panchayat,North Tripura,Jubarajnagar,762164,2,North Ganganagar II North East Para and Madhya Para of North Para,????? ???????? II ????? ????? ???? ??? ???????? ?? ????? ????
104057,North Ganganagar,Village Panchayat,North Tripura,Jubarajnagar,762165,3,North Ganganagar III Madhya Para of South East Para,????? ???????? III ?????? ????? ???? ?? ????????
104057,North Ganganagar,Village Panchayat,North Tripura,Jubarajnagar,762166,4,North Ganganagar IV South West Para,????? ???????? IV ?????? ?????? ????
104057,North Ganganagar,Village Panchayat,North Tripura,Jubarajnagar,762167,5,North Ganganagar V Madhya West Para of Madhya Para,????? ???????? V ???????? ?? ???? ?????? ????
104062,Radhapur,Village Panchayat,North Tripura,Jubarajnagar,109783,1,Radhapur I West Side of North East Radhapur,??????? I ????? ????? ??????? ?? ???? ???
104062,Radhapur,Village Panchayat,North Tripura,Jubarajnagar,762206,2,Radhapur II East side of North East Radhapur,??????? II ????? ????? ??????? ?? ????? ???
104062,Radhapur,Village Panchayat,North Tripura,Jubarajnagar,762207,3,Radhapur III East Radhapur,??????? III ????? ??????? ??
104062,Radhapur,Village Panchayat,North Tripura,Jubarajnagar,762208,4,Radhapur IV North Middle Radhapur,??????? IV ??????? ?? ????? ???? ???
104062,Radhapur,Village Panchayat,North Tripura,Jubarajnagar,762209,5,Radhapur V South East Radhapur,??????? V ?????? ????? ???????
104062,Radhapur,Village Panchayat,North Tripura,Jubarajnagar,762210,6,Radhapur VI Madhya Radhapur,??????? VI ???? ???????
104062,Radhapur,Village Panchayat,North Tripura,Jubarajnagar,762211,7,Radhapur VII South East Radhapur of West Radhapur,??????? VII ?????? ??????? ?? ?????? ????? ???????
104063,Rajnagar,Village Panchayat,North Tripura,Jubarajnagar,87217,1,Rajnagar I Laxmipur,?????? I ??????????
104063,Rajnagar,Village Panchayat,North Tripura,Jubarajnagar,762307,2,Rajnagar II North Rajnagar,?????? II ????? ??????
104063,Rajnagar,Village Panchayat,North Tripura,Jubarajnagar,762308,3,Rajnagar III Bairagi Tilla,?????? III ?????? ????
104063,Rajnagar,Village Panchayat,North Tripura,Jubarajnagar,762309,4,Rajnagar IV Rajnagar Bazar of Ananda Bazar,?????? IV ????? ????? ?? ?????? ?????
104063,Rajnagar,Village Panchayat,North Tripura,Jubarajnagar,762310,5,Rajnagar V Madhya Rajnagar,?????? V ???? ??????
104063,Rajnagar,Village Panchayat,North Tripura,Jubarajnagar,762311,6,Rajnagar VI Rajnagar Colony,?????? VI ?????? ?????
104066,South Ganganagar,Village Panchayat,North Tripura,Jubarajnagar,762377,1,South Ganganagar I Das Para of Sukla Baidhya Para,?????? ???????? I ????? ????? ????
104066,South Ganganagar,Village Panchayat,North Tripura,Jubarajnagar,762378,2,South Ganganagar II Bagan Bazar of North West Ganganagar,?????? ???????? II ?????? ?????? ???????? ?? ????? ?????
104066,South Ganganagar,Village Panchayat,North Tripura,Jubarajnagar,762379,3,South Ganganagar III Norh East Ganganagar Natun Tilla of Tea Garden,?????? ???????? III ?? ??????? ?? ????? ????? ???????? ???? ????
104066,South Ganganagar,Village Panchayat,North Tripura,Jubarajnagar,762380,4,South Ganganagar IV Hatidowal Madhya Para,?????? ???????? IV ????????? ???? ????
104066,South Ganganagar,Village Panchayat,North Tripura,Jubarajnagar,762381,5,South Ganganagar V Chakraborty Para Panchayat Office Area of South East Para,?????? ???????? V ?????? ????? ???? ????????? ???? ? ????????  ???? ?????
104066,South Ganganagar,Village Panchayat,North Tripura,Jubarajnagar,762382,6,South Ganganagar VI Acharjee Para and Debnath Para,?????? ???????? VI ??????? ???? ??? ?????? ????
104067,Sripur,Village Panchayat,North Tripura,Jubarajnagar,90833,1,Sripur I Hospital Colony Para,??????? I ???????? ????? ????
104067,Sripur,Village Panchayat,North Tripura,Jubarajnagar,763171,2,Sripur II Madhya Sripur,??????? II ???? ???????
104067,Sripur,Village Panchayat,North Tripura,Jubarajnagar,763172,3,Sripur III North Sripur colony of North Sripur,??????? III ????? ??????? ?? ????? ??????? ????? ??
104067,Sripur,Village Panchayat,North Tripura,Jubarajnagar,763173,4,Sripur IV East Sripur,??????? IV ????? ???????
104067,Sripur,Village Panchayat,North Tripura,Jubarajnagar,763174,5,Sripur V South Sripur,??????? V ?????? ???????
104067,Sripur,Village Panchayat,North Tripura,Jubarajnagar,763175,6,Sripur VI Lenin Colony,??????? VI ????? ?????
104068,Tangibari,Village Panchayat,North Tripura,Jubarajnagar,88862,1,Tangibari I South Part of Sabajpur of Kakrirpar,???????? I ???????? ?? ??????? ?????? ???
104068,Tangibari,Village Panchayat,North Tripura,Jubarajnagar,763272,2,Tangibari II North and East Part of Sabajpur of Tangibari,???????? II ????????? ??????? ????? ??? ????? ???
104068,Tangibari,Village Panchayat,North Tripura,Jubarajnagar,763273,3,Tangibari III Madhya Tangibari South Part of Madhya Tangibari,???????? III ???? ????????? ???? ???????? ?????? ???
104068,Tangibari,Village Panchayat,North Tripura,Jubarajnagar,763274,4,Tangibari IV South Part of East Batarasi and West Part of Singirbil,???????? IV ????? ???????? ?????? ??? ??? ????????? ?? ?????? ???
104068,Tangibari,Village Panchayat,North Tripura,Jubarajnagar,763275,5,Tangibari V North East Part of East Batarasi and East Part of Singirbil,???????? V ????? ??????? ?? ?????? ????? ??? ??? ????????? ?? ????? ???
104068,Tangibari,Village Panchayat,North Tripura,Jubarajnagar,763276,6,Tangibari VI North East part of Sabajpur,???????? VI ???????? ?? ????? ????? ???
104068,Tangibari,Village Panchayat,North Tripura,Jubarajnagar,763277,7,Tangibari VII South Part of Sabajpur,???????? VII ???????? ?? ?????? ???
104069,Uptakhali,Village Panchayat,North Tripura,Jubarajnagar,763338,1,Uptakhali I Silpara of Uptakhali,????????? I ????????? ?? ???????
104069,Uptakhali,Village Panchayat,North Tripura,Jubarajnagar,763339,2,Uptakhali II Manikcherra Para of Uptakhali,????????? II ????????? ?? ???????? ????
104069,Uptakhali,Village Panchayat,North Tripura,Jubarajnagar,763340,3,Uptakhali III Tipragul of Uptakhali,????????? III ????????? ?? ????????
